id,Title,ASIN,SHP,N_Price,Price,1_W,2_W,3_W,4_W,Inbound,Inv,30,60,90,12m,2000-2025,Parts__Num,SKU
1965,"CONCORD WALLCOVERINGS Wallpaper Border Country Pattern Horse Riders Horses for Cottage Living Room Kid's Bedroom, Beige Brown Black Blue, 6 Inches by 15 Feet HJ6638BD",B07SC4BD5H,,,18.22,,,,,,0,0,0,0,0,17,6638 HJ BD,1A-WQJT-AJDL
1966,"CONCORD WALLCOVERINGS ? Kids Wallpaper Border Sand Castle Ball Beach for Play Room Bedroom, Green Blue Yellow, 15 ft by 7 in CK7764B",B09CBVD2MG,,,18.22,,,,,,0,0,0,0,0,3,7764 CK B,CK7764B_
1967,"CONCORD WALLCOVERINGS Wallpaper Border Kid's Pattern Stars Constellations for Kid's Bedroom Playroom, White Black Yellow, 15 ft by 7 in CK7814B",B0BJRPXZMQ,,,18.77,,,,,,6,0,0,0,0,0,7814 CK B,CK7814B_
1968,"CONCORD WALLCOVERINGS Wallpaper Border Vintage Pattern Country Flags The USA for Cottage Farmhouse Living Room, Blue Green Red Beige, 15 ft by 7 in CL41011B",B0BJRZXLVQ,,,18.77,,,,,,6,0,0,0,0,0,41011 CL B,CL41011B_
1969,"CONCORD WALLCOVERINGS ? Kids Wallpaper Border Pirates Treasures for Play Room Bedroom, Blue Brown Red White Yellow, 15 ft by 7 in CM79600",B09MR5CXWZ,,,18.77,,,,,,6,0,0,0,0,2,79600 CM,CM79600_
1970,"CONCORD WALLCOVERINGS ? Kids Wallpaper Border Military Aircrafts for Living Room Home Office Play Room, White Grey Red, 15 ft by 7 in CM79602",B09MR4Z4QC,,,18.22,,,,,,0,0,0,0,0,0,79602 CM,CM79602_
1971,"CONCORD WALLCOVERINGS ? Hip Girl Wallpaper Border Beige, Red, Purple, Orange, Blue 9 Inches by 15 Feet CM79607",B08Y5ZW2YZ,,,18.77,,,,,,0,0,0,0,0,0,79607 CM,CM79607_
1972,"CONCORD WALLCOVERINGS ? Kids Wallpaper Border Cartoon Girls for Play Room Bedroom, Blue Pink Orange White, 15 ft by 9 in CM79608",B09MR423Z8,,,18.22,,,,,,4,0,0,0,0,3,79608 CM,CM79608_
1973,"CONCORD WALLCOVERINGS Classic Fruit Trees Wallpaper Border Featuring Pears andOranges Plants in Pots, Colors Green Yellow Beige Blue, Size 7 Inches by 15 Feet KC78047",B07RM8KRCT,,,18.22,,,,,,0,0,0,0,0,0,KC78047,CN-1O7X-39DQ
1974,"CONCORD WALLCOVERINGS ? Wallpaper Border Retro Floral Pattern Bloomed Roses for Living Room Bedroom, Colors Burgundy Yellow Brown Green Purple, Size 5.25 Inches by 15 Feet CN76725",B097TWCNTD,,,18.77,,,,,,0,0,0,0,0,0,76725 CN,CN76725_
1975,"CONCORD WALLCOVERINGS ? Wallpaper Border Floral Pattern Bouquets Flowers Leaves for Kitchen Dining Area Cottage Farmhouse Living Room, Blue Beige White Green, 5.25 Inches by 15 Feet CN76732",B0B9253MC5,,,18.77,,,,,,1,0,0,0,0,0,76732 CN,CN76732_
1976,"CONCORD WALLCOVERINGS ? Wallpaper Border Floral Pattern Roses Leaves for Living Room Kitchen Dining Area, Yellow Blue Green, 15 ft by 5 in CN76736DC /O",B08SHZNCC4,,,18.22,,,,,,0,0,0,0,0,4,CN76736DC,CN76736DC_
1977,"Wallpaper Border Floral Design Flowers Leaves, One Side Laser Cut, Prepasted, Colors Camel Falu Red Champagne Green, Size 5.5 Inch by 15 Ft CN76742DC /O",B08PDT9R43,,,18.77,,,,,,1,0,0,0,0,1,76742 CN DC,CN76742DC_
1978,"CONCORD WALLCOVERINGS Wallpaper Border Kids Pattern Plushies Cats Bears Rabbits Hearts Stars for Kid's Bedroom Playroom, Brown Blue Yellow Red Green, 7 Inches by 15 Feet SU75936",B07RY3K1KG,,,18.22,,,,,,0,0,0,0,0,0,75936 SU,CO-439O-C5U9
1979,"CONCORD WALLCOVERINGS ? Wallpaper Border Fruit Vine Pattern Apple Pear Plums Grape Leaves for Kitchen Living Room, Green Purple Yellow Red, 4.75 Inches by 15 Feet CO77190DC",B09KM7ZVFT,,,18.77,,,,,,6,0,0,0,0,0,77190 CO DC,CO77190DC_X
1980,Old Time City Street Wallpaper Border - Warren CUP3381B,B07Y5PH7T8,,,18.99,,,,,,0,0,0,0,0,2,3381 CUP,CP-PKWT-26FV
1981,"CONCORD WALLCOVERINGS ? Wallpaper Border Fruits Pattern Apples Pears Grapes Strawberries on Blue Tablecloth, Cream Blue Green Red Purple Brown for Kitchen Dining Area, 9 Inches by 15 Feet CP033105B",B09K49TLFL,,,18.77,,,,,,3,0,0,0,0,0,33105 CP B,CP033105B_
1982,10 1/4 in x 15 ft Prepasted Wallpaper Borders - Garden Wall Paper Border CP033111B,B07JJC4WBR,,,18.22,,,,,,0,0,0,0,0,0,033111 CP B,CP033111B
1983,"CONCORD WALLCOVERINGS ? Wallpaper Border Floral Pattern Flowers in Ceramic Pots Wooden Fence, Yellow Purple Orange Brown Blue, 10.25 Inches by 15 Feet CP033113",B0B72PMN7F,,,18.77,,,,,,0,0,0,0,0,0,33113 CP,CP033113_
1984,"Wallpaper Border Flower Pots 10.25"" x 15' CP033114B",B07PDZS8Y9,,,17.77,,,,,,0,0,0,0,0,0,033114 CP B,CP033114B_1
1985,"CONCORD WALLCOVERINGS ? Wallpaper Border Floral Pattern Garden Orchids Flowerpots for Farmhouse Cottage Kitchen, Beige Orange Brown Green Lilac, 15 Feet by 10.4 Inches CP033114B",B0BHFFF8MT,,,18.77,,,,,,7,0,0,0,0,0,033114 CP B,CP033114B_XX
1986,"CONCORD WALLCOVERINGS Wallpaper Border Country Pattern Tableware Ivy Flowers for Cottage Kitchen Dining Room, Beige Red Pink Green, 15 Feet by 7 Inches CP033123B",B07RJTHJ91,,,18.77,,,,,,0,0,0,0,0,0,33123 CP B,CP033123B
1987,"CONCORD WALLCOVERINGS Retro Travel Photos Postcards Wallpaper Border Featuring Mountain Postcards on Wood, Colors Red Gray Yellow Blue Brown Green, Size 9.5 Inches by 15 Feet LM9028B",B07RST1HNV,,,18.77,,,,,,0,0,0,0,0,22,LM9028B,1C-VNSH-Q6GZ
1988,"CONCORD WALLCOVERINGS ? Wallpaper Border Fruits Pattern Apples Pears Plums Eggs Flowers Leaves for Kitchen Cottage, Green Orange Beige, 15 ft by 9 in CP033133B",B07QBR5W5G,,,18.77,,,,,,6,0,0,0,0,0,033133 CP B,CP033133B_
1989,"CONCORD WALLCOVERINGS ? Wallpaper Border Country Pattern Vegetables Basket Rooster Jugs for Kitchen Dining Area Cottage, Yellow Green Orange Beige, 15 ft by 4 in CP033152B",B09K4J56X8,,,18.22,,,,,,0,0,0,0,0,3,33152 CP B,CP033152B_
1990,"CONCORD WALLCOVERINGS ? Wallpaper Border Floral Pattern Baskets Sunflowers Pansies Violets for Living Room Cottage, Brown Yellow Green White Purple Pink Beige, 9 Inches by 15 Feet CP033173B",B09K4DVP1X,,,18.77,,,,,,0,0,0,0,0,6,33173 CP B,CP033173B_
1991,"CONCORD WALLCOVERINGS ? Wallpaper Border Country Pattern Roosters for Kitchen Cottage Farmhouse, Green Yellow Brown Red, 15 ft by 7 in CP033205B",B09KDS2HP9,,,18.77,,,,,,4,0,0,0,0,1,33205 CP B,CP033205B_
1992,"CONCORD WALLCOVERINGS ? Wallpaper Border Country Pattern Roosters in Frames for Kitchen Cottage, Blue Yellow Cream Red White Brown Grey, 7 Inches by 15 Feet CP033209B",B09KHJZ2BD,,,18.66,,,,,,3,0,0,0,0,1,33209 CP B,CP033209B_
1993,Green Birdhouses Wallpaper Border,B002LE51QG,,,18.66,,,,,,1,0,0,0,0,0,SI37192B,1C-Y0K9-IQCX
1994,"CONCORD WALLCOVERINGS ? Wallpaper Border Abstract Pattern Lines Painting for Bathroom, Blue Green Gold, 7 Inches by 15 Feet CQ104750B",B0BDGNS81L,,,18.77,,,,,,0,0,0,0,0,0,104750 CQ B,CQ104750B_
1995,Patton Wallpaper Wallcovering Pretty Prints 3 PP79052,B00K36Y2U0,,,18.22,,,,,,0,0,0,0,0,0,Eades PP79052,CR-7AMI-U236
1996,SAFFRON Wallpaper -FP011113B Wallpaper,B002LDYVLI,,,18.22,,,,,,0,0,0,0,0,0,011113 FP B,CR-BQEH-CXAW
1997,"CONCORD WALLCOVERINGS Abstract Wallpaper Border Featuring Animal Print Plants on a Brown Background, Colors Green Yellow Black, Size 8 Inches by 15 Feet UE946B",B07RY3VP3K,,,18.22,,,,,,0,0,0,0,0,0,UE946B,CR-Z8P4-D819
1998,Blue Mountain Wallcoverings CR061142B Kitchen & Bath Resources Border /Bronze/Dark Gray/Gold/Medium Gray/Mustard/Tan,B00Y4K7X48,,,18.77,,,,,,0,0,0,0,0,0,873,CR061142B
1999,7 in x 15 ft Prepasted Wallpaper Borders - Floral Wall Paper Border CR72841N,B07KMXDMH3,,,18.22,,,,,,0,0,0,0,0,20,CR72841N,CR72841N_
2000,"CONCORD WALLCOVERINGS Wallpaper Border Vintage Pattern Napkins Cherries Apples Grapes Strawberries for Cottage Kitchen Dining Room, Beige Blue Green Red, 15 Feet by 7 Inches CS503B",B08QDQPVW2,,,18.77,,,,,,0,0,0,0,0,0,503 CS B,CS503B_
2001,"CONCORD WALLCOVERINGS ? Wallpaper Border Fruits Pattern Berries Flowers Leaves for Cottage Kitchen Dining Room, White Green Red, 15 ft by 9 in HS7879B",B07S312FVT,,,18.22,,,,,,0,0,0,0,0,27,7879 HS B,1D-TEH7-EZO1
2002,"CONCORD WALLCOVERINGS Wallpaper Border Kids Pattern Printed Stars for Kid's Room Play Room Bedroom, Beige Blue Red, 15 ft by 5.5 in CS541B",B0BKB1FQPZ,,,18.77,,,,,,6,0,0,0,0,0,541 CS B,CS541B_
2003,"Table with Tea Party Set Fruits Kitchen Beige Wide Wallpaper Border Retro Design, Roll 15' x 9''",B0764KDCC9,,,18.22,,,,,,0,0,0,0,0,0,CS8331B,CS8331B
2004,"CONCORD WALLCOVERINGS ? Wallpaper Border Floral Pattern Vintage Flowers Ornament Leaves for Living Room Bedroom Bathroom, Cream Purple Red Green, 15 ft by 7 in CS8371B",B091D4YYVM,,,18.77,,,,,,0,0,0,0,0,0,8371 CS B,CS8371B_
2005,"CONCORD WALLCOVERINGS ? Wallpaper Border Sport Pattern Basketball Court Players for Home Gymnastic Room Gym Teenager Bedroom, Red Blue Brown White Green, 10.5 Inches by 15 Feet CT102232",B09CBMF92W,,,18.77,,,,,,0,0,0,0,0,0,102232 CT,CT102232_
2006,"CONCORD WALLCOVERINGS ? Wallpaper Border Animals Pattern Cats for Bedroom Living Room Play Room, Red White Black, 15 ft by 9 in CT3032B",B09JKVZNJ7,,,18.22,,,,,,0,0,0,0,0,0,3032 CT B,CT3032B_
2007,"CONCORD WALLCOVERINGS ? Kids Wallpaper Border Flowers for Play Room Bathroom Bedroom, Pink Yellow, 15 ft by 7 in CT78165L",B09K812M6D,,,18.22,,,,,,0,0,0,0,0,0,78165 CT L,CT78165L_
2008,7 in x 15 ft Prepasted Wallpaper Borders - Floral Wall Paper Border 5801985,B07KMXJVDN,,,18.22,,,,,,0,0,0,0,0,3,5801985,1E-XTNR-207R
2009,"CONCORD WALLCOVERINGS ? Wallpaper Border Vintage Pattern Ornaments for Kitchen Bathroom Bedroom Dining, Red Yellow, Size 15 Feet x 7 Inches CT78186",B07RGM42Y3,,,18.77,,,,,,0,0,0,0,0,1,78186 CT,CT78186_
2010,9 1/2 in x 15 ft Prepasted Wallpaper Borders - Floral Wall Paper Border WV7460B,B07KMWXKMS,,,18.22,,,,,,0,0,0,0,0,60,WV7460B,CU-RA0K-OTSB
2011,"Wallpaper Border Abstract Circles Wave Design, Prepasted, Colors Beige Brown Red White, Size 7 Inch by 15 Ft CU78217",B08NLJJYHT,,,18.77,,,,,,0,0,0,0,0,0,78217 CU,CU78217_
2012,"CONCORD WALLCOVERINGS ? Wallpaper Border Modern Geometric Pattern Abstract Style Circles Waves, Beige Brown Jonquil, Size 7 Inches by 15 Feet CU78219",B09F7V2C7S,,,18.77,,,,,,0,0,0,0,0,0,CU78219,CU78219_
2013,"CONCORD WALLCOVERINGS Wallpaper Border Art Pattern Circles Lines for Cottage Bedroom Living Room, Gray Beige, 15 ft by 10.5 in CU78223",B0BJSN9515,,,18.77,,,,,,5,0,0,0,0,0,78223 CU,CU78223_
2014,"CONCORD WALLCOVERINGS ? Wallpaper Border Modern Pattern Cutlery for Dining Area Kitchen Cottage, Green White Yellow, 15 ft by 7 in CU78225",B09K4JHXYF,,,18.22,,,,,,0,0,0,0,0,0,78225 CU,CU78225_
2015,"CONCORD WALLCOVERINGS ? Wallpaper Border Art Pattern Fruits for Cottage Kitchen Dining Room, Yellow Green Red Orange, 15 ft by 7 in CU78228",B0BJS91L1C,,,18.77,,,,,,6,0,0,0,0,0,78228 CU,CU78228_
2016,"CONCORD WALLCOVERINGS ? Wallpaper Border Fruits Pattern Apple Lemon Lime for Kitchen Cottage Farmhouse, Green Yellow Red, 15 ft by 7 in CU78229",B09KS9LS3W,,,18.77,,,,,,3,0,0,0,0,1,78229 CU,CU78229_
2017,"CONCORD WALLCOVERINGS Wallpaper Border Art Pattern Dots Words for Cottage Kitchen Dining Room, Burgundy Beige, 15 ft by 7 in CU78230",B0BJS64K5M,,,18.77,,,,,,6,0,0,0,0,0,78230 CU,CU78230_
2018,"CONCORD WALLCOVERINGS Wallpaper Border Art Pattern Dots Words for Cottage Kitchen Dining Room, Brown Beige, 15 ft by 7 in CU78233",B0BJRYS69S,,,18.77,,,,,,6,0,0,0,0,0,78233 CU,CU78233_
2019,Black Yellow Stones Wallpaper Border 49063,B00IZGUGRI,,,18.22,,,,,,0,0,0,0,0,0,49063,1F-L6W6-2NZY
2020,"CONCORD WALLCOVERINGS Wallpaper Border Art Pattern Dots Words for Cottage Kitchen Dining Room, Red Brown, 15 ft by 7 in CU78234",B0BJSFBKWR,,,18.77,,,,,,6,0,0,0,0,0,78234 CU,CU78234_XX
2021,"CONCORD WALLCOVERINGS ? Wallpaper Border Vintage Pattern Coffee Cups for Kitchen Cottage Dining Area, Beige Yellow Brown Grey, 15 Ft by 7 in CU78237",B09R3MZWGG,,,18.77,,,,,,0,0,0,0,0,0,78237 CU,CU78237_1_
2022,"CONCORD WALLCOVERINGS Wallpaper Border Animal Pattern Landscape Trees River Geese for Cottage Kid's Bedroom, Green Blue Gray Beige, 15 Feet by 9 Inches CUP3352",B07S8SBZR2,,,18.22,,,,,,0,0,0,0,0,0,3352 CUP,CUP3352
2023,"CONCORD WALLCOVERINGS ? Wallpaper Border Animal Pattern Landscape Trees River Geese for Cottage Kid's Bedroom, Green Blue Gray Brown, 9 Inches by 15 Feet CUP3355",B07QCQWB9N,,,18.22,,,,,,0,0,0,0,0,3,3355 CUP,CUP3355_1
2024,York Wallpaper Wallcovering Girl Power 2 PW4104BD,B00K37QYB4,,,17.22,,,,,,0,0,0,0,0,0,Eades PW4104BD,1F-N7FI-I51X
2025,"CONCORD WALLCOVERINGS ? Wallpaper Border Floral Pattern Flowers Berries Leaves for Living Room Bedroom Kitchen, Cream Lilac Red Green, 15 ft by 5 in CUP3393",B096W9932X,,,18.22,,,,,,0,0,0,0,0,6,3393 CUP,CUP3393_
2026,"CONCORD WALLCOVERINGS Elegant Geometric Figures Wallpaper Border Featuring Abstract Floral Design, Colors Dark Blue Golden, Size 7 Inches by 15 Feet VO4457B",B07S97NVJZ,,,18.22,,,,,,0,0,0,0,0,0,VO4457B,CV-NG7R-Q0UL
2027,9 in x 15 ft Prepasted Wallpaper Borders - Fruits Wall Paper Border CV103730,B07JJCD447,,,18.22,,,,,,0,0,0,0,0,1,103730 CV,CV103730
2028,"CONCORD WALLCOVERINGS ? Wallpaper Border Fruits Pattern Berries Baskets Mushrooms Leaves, Die Cut Edge for Kitchen Cottage Dining Area, Beige Red Blue Green, 15 Feet by 9 Inches CV103730",B0BHFF4Q3N,,,18.77,,,,,,6,0,0,0,0,0,103730 CV,CV103730_XX
2029,"CONCORD WALLCOVERINGS ? Wallpaper Border Nautical Pattern Boats Houses for Bedroom Guestroom Cottage, Colors Blue Brown Beige Yellow Red, Size 7 Inches by 15 Feet CW32121B",B092G1PBX4,,,18.22,,,,,,0,0,0,0,0,9,32121 CW B,CW32121B_
2030,"CONCORD WALLCOVERINGS ? Wallpaper Border Vintage Pattern Voyage Explorer Supplies for Home Office Living Room Cottage, Brown Beige Orange Green, 15 ft by 8 in CW32132B",B09JT5TCFL,,,18.22,,,,,,2,0,0,0,0,0,32132 CW B,CW32132B_
2031,"I'm so Bored Kids Bedroom Wallpaper Border, Multicolor, Size 9 Inches by 15 Feet Long ISB4001B",B002LDRGAQ,,,18.22,,,,,,0,0,0,0,0,0,ISB4001B,1I-M3CG-EQG7
2032,"CONCORD WALLCOVERINGS ? Wallpaper Border Fruits Pattern Pineapples Flowers for Kitchen Cottage Dining Area, Green Brown Beige Yellow, 15 ft by 8 in CW32142B",B09KM97DNJ,,,18.22,,,,,,0,0,0,0,0,0,32142 CW B,CW32142B_
2033,"CONCORD WALLCOVERINGS ? Wallpaper Border Beach Pattern Umbrellas Ball Flip Flops Toys for Bathroom Cottage, Green Blue Cream Pink Red, 5.25 Inches by 15 Feet CW32172B",B09KNXYHJM,,,18.77,,,,,,3,0,0,0,0,1,32172 CW,CW32172B_XX
2034,"CONCORD WALLCOVERINGS ? Wallpaper Border Nature Pattern Featuring Sailboats Lake Houses and Forest on The Background for Living Room Cottage, Blue Green Gray, 15 Feet by 7 Inches CW32203B",B0778SDZ7R,,,18.99,,,,,,0,0,0,0,0,2,CW32203B,CW32203B
2035,"Martini Recipe Bar Kitchen Grey Wallpaper Border Retro Design, Roll 15' x 6.87''",B0764JBWC4,,,18.22,,,,,,0,0,0,0,0,0,5510863,CX-U4GI-L7WI
2036,"Concord Wallcoverings Wallpaper Border Vintage Farmer Market Vegetables Fruits Wooden Shelfs for Kitchen Dining Area Farm House, Colors Blue Red Green Brown Beige, Size 9.5 Inches by 15 Feet CX20254B",B097TVCMXS,,,18.77,,,,,,0,0,0,0,0,1,20254 CX B,CX20254B_
2037,"CONCORD WALLCOVERINGS ? Classic Floral Wallpaper Border Featuring Flowers Vine on a Curtains, Colors Beige Green Red, Ideal for Bedroom Living Room Dining Area, Size 7.875 Inches by 15 Feet CH77642DC",B07S2BFT51,,,16.77,,,,,,0,0,0,0,0,18,77642 CH,1J-PYCF-EW39
2038,7 in x 15 ft Prepasted Wallpaper Borders - Sports Wall Paper Border ngb76805,B07JH66H2M,,,18.66,,,,,,0,0,0,0,0,0,ngb76805,CY-YCFJ-GKGO
2039,9 1/4 in x 15 ft Prepasted Wallpaper Borders - Birds Wall Paper Border NM6650B,B07KMXHF4T,,,18.99,,,,,,0,0,0,0,0,2,NM6650B,CZ-6CA8-IJTH
2040,"CONCORD WALLCOVERINGS ? Elegant Wallpaper Border Featuring Feathers Sconce on a Beige Background, Colors White Gold, Size 7 Inches by 15 Feet 30646178B",B07QHY27FD,,,18.77,,,,,,0,0,0,0,0,0,30646178B,Concord_WB_0011
2041,"CONCORD WALLCOVERINGS Elegant Multicolored Roses Wallpaper Border Featuring Flowers Leaves, Colors Pink Yellow Red Green, Size 3.5 Inches by 15 Feet 31616080",B07QFSKRKR,,,18.22,,,,,,0,0,0,0,0,0,31616080,Concord_WB_0018
2042,"CONCORD WALLCOVERINGS Classic Floral Wallpaper Border Featuring Flowers Vine on a Taupe Satin Background, Size 6.87 Inches by 15 Feet 51306050",B07QJ2G7LL,,,18.22,,,,,,0,0,0,0,0,35,51306050,Concord_WB_0037
2043,"CONCORD WALLCOVERINGS ? Vintage Floral Wallpaper Border Featuring Tulips and Roses Vases, Colors Velvet Pink Yellow Green, Size 10.25 Inches by 15 Feet 5507150",B07QDPJB7L,,,18.77,,,,,,0,0,0,0,0,6,5507150,Concord_WB_0047
2044,"CONCORD WALLCOVERINGS ? Wallpaper Border Vintage Pattern Chairs Flower Pots for Cottage Farmhouse Living Room, Blue Green Beige, 15 ft by 7 in 5813685",B07QFSLGZJ,,,18.22,,,,,,0,0,0,0,0,7,5813685,Concord_WB_0067
2045,"CONCORD WALLCOVERINGS ? Cocktail Style Wallpaper Border Featuring Bar Glasses with Fruit Drinks, Colors Blue Yellow Magenta Purple Green, Size 7.62 Inches by 15 Feet 5815185",B07QBR52VZ,,,18.77,,,,,,6,0,0,0,0,7,5815185,Concord_WB_0069
2046,10 1/4 in x 15 ft Prepasted Wallpaper Borders - Country Wall Paper Border 585992,B07KMWSB7M,,,18.22,,,,,,0,0,0,0,0,5,585992,1N-CKUR-OPCF
2047,"Wallpaper Border Key Lime Daisies 9.5"" x 15' BT2729B",B07QCQR546,,,18.22,,,,,,0,0,0,0,0,0,2729 BT B,Concord_WB_0160
2048,"Concord Wallcoverings Floral Theme Wallpaper Border Featuring Small White Flowers, Beige and Green Background, Ideal for Kitchen Bathroom Bedroom or Living Room, Size 8.87 Inches by 15 Feet BT77073B",B07QBR4KC1,,,18.77,,,,,,4,0,0,0,0,21,77073 BT B,Concord_WB_0162
2049,"CONCORD WALLCOVERINGS ? Wallpaper Border Vintage Pattern Sewing Thread Needles for Cottage Home Office, Beige Blue Red Green, 15 ft by 5 in BT77700",B07QHXNY9D,,,18.77,,,,,,0,0,0,0,0,5,77700 BT,Concord_WB_0164
2050,Graham and Brown Ivy Topiary Border,B001U6BLYC,,,16.88,,,,,,0,0,0,0,0,8,Pattern Number: 00029158,29158
2051,"CONCORD WALLCOVERINGS ? Wallpaper Border Country Pattern Duck Salmon Boxes Binoculars Trophies for Cottage, Brown Blue Green Red, 9 Inches by 15 Feet LM8935B",B07S5BJVV3,,,18.22,,,,,,0,0,0,0,0,6,8935 LM B,1P-472B-B0DD
2052,"CONCORD WALLCOVERINGS Wallpaper Border Garden Pattern Flower Pots Watering Cans Flowers for Cottage Kitchen Dining Room, Brown Beige Burgundy Orange, 15 Feet by 4.5 Inches BV006152B",B07QHZ2ZSL,,,18.22,,,,,,0,0,0,0,0,1,006152 BV B,Concord_WB_0170
2053,"CONCORD WALLCOVERINGS ? Wallpaper Border Featuring Mountain Village Pastoral Painting of Brick Houses, River and Forest, Size 7 Inch by 15 Ft BV021132B",B07QHZ7W4M,,,18.77,,,,,,6,0,0,0,0,27,BV021132B,Concord_WB_0173
2054,"Wallpaper Border Surfing Sun Board Waves Sports Salmon Pink 15' x 6"" BZ9222BD /O",B07QGXCVM5,,,18.22,,,,,,0,0,0,0,0,9,9222 BZ BD,Concord_WB_0177
2055,"Wallpaper Border Green Apple 5.25"" X 15' Ck70342",B07QHXZ13H,,,18.22,,,,,,0,0,0,0,0,0,70342 CK,Concord_WB_0189
2056,"CONCORD WALLCOVERINGS ? Floral Theme Wallpaper Border Featuring Peach Roses and Blue Violets on a Green Leaves Background, Size 5.25 Inches by 15 Feet CN76728",B07QDPJ7Y7,,,18.77,,,,,,0,0,0,0,0,8,CN76728,Concord_WB_0191
2057,"CONCORD WALLCOVERINGS Decorative Wallpaper Border Floral Design Leafs Flowers, One Side Laser Cut, Colors Linen Lion Red Brown Green, Size 5 Inch by 15 Ft CN76739DC",B07QDPJ8LS,,,18.77,,,,,,0,0,0,0,0,22,CN76739DC,Concord_WB_0193
2058,"CONCORD WALLCOVERINGS Beautiful Floral Wallpaper Border with Lovely Painted Flowers, Colors Watercolors Blue Green White, Perfect for Bedroom, Living Room, Any Room, Size 7 Inches by 15 Feet CT78167",B07QHXT9SM,,,18.22,,,,,,0,0,0,0,0,4,78167 CT,Concord_WB_0205
2059,"Concord Wallcoverings Classic Typography Classic Wallpaper Featuring Grapes Vino Rouge Wine in Cool Font with a Lovely Background, Colors Brown Beige, Size 7 inches by 15 feet CU78232",B07QJ1LBDX,,,18.22,,,,,,0,0,0,0,0,0,78232 CU,Concord_WB_0209
2060,"CONCORD WALLCOVERINGS Classic Tropical Theme Wallpaper Border Featuring Wicker Fence with Pinecone and Tabaco Leaves, Color Beige, Size 4 Inches by 15 Feet Cw32023b",B07QHZ3KT6,,,18.77,,,,,,6,0,0,0,0,36,32023 CW B,Concord_WB_0213
2061,READY SET GROW Wallpaper -SK6449BD Wallpaper,B002LDEKGO,,,17.22,,,,,,0,0,0,0,0,0,6449 SK BD,1T-57I4-3DSB
2062,"CONCORD WALLCOVERINGS Wallpaper Border Vintage Pattern Floral Wreaths, Die Cut Edge for Cottage Bedroom Living Room, Cream Green Blue Purple, 15 ft by 7 in FAM65071B",B07QBR4SX3,,,18.22,,,,,,0,0,0,0,0,3,65071 FAM B,Concord_WB_0237
2063,"CONCORD WALLCOVERINGS ? Wallpaper Border Floral Pattern Leaves Berries for Cottage Bedroom Living Room, Green Burgundy, 15 ft by 7 in FFB2584",B07QHXQ198,,,18.77,6,,,,,0,0,0,0,0,0,2584 FFB,Concord_WB_0241
2064,"CONCORD WALLCOVERINGS Wallpaper Border Art Pattern Geometrical Ornaments Flowers for Cottage Bedroom Living Room, Green Beige, 15 ft by 7 in FR834B",B07QFSKDXT,,,18.22,,,,,,0,0,0,0,0,0,834 FR B,Concord_WB_0244
2065,Concord Wallcovering Vintage Wallpaper Border Traditional Abstract Design with Beige Leaves & Flowers 7 Inches by 15 Feet FT75814,B07QFSKSMG,,,18.77,,,,,,0,0,0,0,0,73,75814 FT,Concord_WB_0249
2066,"CONCORD WALLCOVERINGS Wallpaper Border Country Pattern Village Houses Trees for Cottage Kitchen Dining Room, Brown Beige Green, 15 Feet by 5.25 Inches GB30312",B07QBR58J2,,,18.22,,,,,,0,0,0,0,0,0,30312 GB,Concord_WB_0254
2067,"CONCORD WALLCOVERINGS Modern Wild Nature Wallpaper Border Featuring Flowers on a Yellow Background, Colors Green Orange Purple, Size 10.25 Inches by 15 Feet BN1920B",B07RG7Y7VJ,,,18.22,,,,,,0,0,0,0,0,0,BN1920B,1W-AIFX-P3NS
2068,"CONCORD WALLCOVERINGS ? Amazing Vintage Golf Club Wallpaper Border Featuring Men Golfing Mansion Lake, Colors Green Blue Red and Yellow Size 6 Inches by 15 Feet GF7129BD",B07QHXLPY5,,,18.22,,,,,,0,0,0,0,0,47,7129 GF BD,Concord_WB_0260
2069,"CONCORD WALLCOVERINGS Floral Wallpaper Border Featuring Blue Yellow and Orange Pansies Flowers, Size 6.75 Inches by 15 Feet GG54022B",B07QGXFPSC,,,18.22,,,,,,0,0,0,0,0,28,54022 GG B,Concord_WB_0264
2070,"CONCORD WALLCOVERINGS ? Vintage Floral Wallpaper Border Features Rustic Pansy Flowers Smiling, Colors Blue Violet Green Yellow Beige, Size 7 Inches by 15 Feet GG54023B",B07QCQS92J,,,18.22,,,,,,0,0,0,0,0,19,54023 GG B,Concord_WB_0265
2071,"Concord Wallcoverings Wallpaper Border Sports Pattern Surfboards Palms Words Stars for Boy's Bedroom Playroom Home Gym, Green Blue Red Cream, 15 ft by 9 in GU79215",B07QHZKRXP,,,18.22,,,,,,0,0,0,0,0,0,79215 GU,Concord_WB_0274
2072,"CONCORD WALLCOVERINGS Decorative Forest Wallpaper Border Featuring Gobblers Hens Turkey Trees Fallen Leaves Woods, Colors Green Black Brown Red, Size 10.5 inches by 15 feet HG522B",B07QHXZYZF,,,18.22,,,,,,0,0,0,0,0,3,522 HG B,Concord_WB_0282
2073,"CONCORD WALLCOVERINGS Classic Fruits Painting Wallpaper Border Featuring Grapes Pears and Cherries, Colors Yellow Purple Green, Size 7 Inches by 15 Feet TK78258",B07RYX8NQG,,,18.22,,,,,,0,0,0,0,0,0,TK78258,1W-H9ZB-P6JY
2074,"Concord Wallcoverings Wallpaper Border Vintage Pattern Kitchenware Plates Cups Teakettle for Cottage Kitchen Dining Room, Beige Green Red, 15 ft by 10.4 in IG75155B",B07QFSKX42,,,18.22,,,,,,0,0,0,0,0,0,75155 IG B,Concord_WB_0294
2075,"CONCORD WALLCOVERINGS Wallpaper Border Sports Pattern Bicycling Paris Competition for Kid's Bedroom Playroom Home Gym, Blue Yellow, 15 Feet by 9 Inches IN2620B",B07QHZMRX2,,,18.22,,,,,,0,0,0,0,0,0,2620 IN B,Concord_WB_0296
2076,"CONCORD WALLCOVERINGS ? Wallpaper Border Vintage Pattern Framed Fruits Flowers for Kitchen Dining Area Cottage, Beige Blue Pink Green, 15 ft by 10 in JT7430B",B07QCQSQ16,,,18.22,,,,,,0,0,0,0,0,6,7430 JT B,Concord_WB_0304
2077,"CONCORD WALLCOVERINGS Aesthetic Red Berries Wallpaper Border Featuring Flowers and Berries, Colors Red Yellow Green, Size 5.25 Inches by 15 Feet KT77904",B07RRQTKBY,,,18.77,,,,,,0,0,0,0,0,10,KT77904,1W-IVJ2-XJ3W
2078,"CONCORD WALLCOVERINGS ? Wallpaper Border Floral Pattern Blossom Leaves for Bedroom Living Room, Red Green Yellow, 15 ft by 7 in JT7486B",B07QBR59BS,,,18.22,,,,,,0,0,0,0,0,0,7486 JT B,Concord_WB_0307
2079,"CONCORD WALLCOVERINGS ? Retro Fruits Wallpaper Border Featuring Pears Apples Grapes and Leaves on Grey Background, Colors Olive Green Shades of Purple, Size 7 Inches by 15 Feet KA75864DC",B07QHXQ9GJ,,,18.22,,,,,,0,0,0,0,0,0,Ka75864dc,Concord_WB_0309
2080,"CONCORD WALLCOVERINGS ? Kitchen Wallpaper Border Grapes Apples Pears Cherries Leaves, Colors Green Beige Purple Red, Size 7 Inch by 15 Feet Ka75865dc",B07QCQSLYY,,,18.22,,,,,,0,0,0,0,0,13,75865 KA DC,Concord_WB_0310
2081,"Concord Wallcoverings Wallpaper Border Fruit Pattern Apples Pears Grapes, Die Cut Edge for Cottage Kitchen Dining Room, Beige Green Purple, 15 ft by 7.5 in KA75866DC",B07QBR512F,,,18.22,,,,,,0,0,0,0,0,0,75866 KA DC,Concord_WB_0311
2082,"CONCORD WALLCOVERINGS Wallpaper Border Fruit Pattern Apples Flowers Berries, Die Cut Edge for Cottage Kitchen Dining Room, Beige Blue Green Purple, 15 ft by 7 in KA75874DC",B07QCQS6XW,,,18.22,,,,,,0,0,0,0,0,0,75874 KA DC,Concord_WB_0313
2083,"Concord Wallcovering Prepasted Retro Wallpaper Border Featuring Laundry and Drying Clothes Line, Color Beige, Size 10.25 Inches by 15 Feet KB6151B",B07QFSL1ZT,,,18.77,,,,,,0,0,0,0,0,75,6151 KB,Concord_WB_0315
2084,"CONCORD WALLCOVERINGS Decorative Floral Wallpaper Border Featuring Flowers On Pink Background, Colors Pink White Mustard, Perfect for Bedroom Kid?s Room Living Room, Size 7 inches by 15 feet KB8549",B07QFSKTM5,,,18.22,,,,,,0,0,0,0,0,0,8549 KB,Concord_WB_0317
2085,"CONCORD WALLCOVERINGS Wallpaper Border Vintage Pattern Fruit Trees in Pots, Die Cut Edge for Cottage Kitchen Dining Room, Blue Green Beige, 15 ft by 7 in KBB55043",B07QDPJKXG,,,18.77,,,6,,,6,0,0,0,0,0,55043 KBB,Concord_WB_0318
2086,"CONCORD WALLCOVERINGS Wallpaper Border Vintage Pattern Circus Monkey Leopards Flowers for Kid's Bedroom Playroom, Beige Green Blue Red Brown, 9 Inches by 15 Feet LT9414B",B07RTZ774K,,,18.22,,,,,,0,0,0,0,0,0,9414 LT B,1W-YOAB-RCW2
2087,"Wallpaper Border Fruit Trees in Pots 7"" X 15' Kc78046",B07QGX9ZD8,,,18.99,,,,,,0,0,0,0,0,39,78046 KC,Concord_WB_0326
2088,"CONCORD WALLCOVERINGS Wallpaper Border Kitchen Pattern Vegetables Peppers Eggplants Tomatoes for Cottage Kitchen Dining Room, Green Beige, 15 Feet by 7 Inches KE30070B",B07QHVHDX3,,,18.22,,,,,,0,0,0,0,0,0,30070 KE B,Concord_WB_0331
2089,"Lighthouses in Wooden Frames Sailboats on Mantel Darkest Green Wallpaper Border Retro Design, Roll 15' x 9""",B07B4L7CQ3,,,18.22,,,,,,2,0,0,0,0,12,ADV2091B,1X-AX2H-LT6K
