id,Title,ASIN,SHP,N_Price,Price,1_W,2_W,3_W,4_W,Inbound,Inv,30,60,90,12m,2000-2025,Parts__Num,SKU
2997,"CONCORD WALLCOVERINGS Wallpaper Border Floral Pattern Flowers Leaves Lines for Bedroom Living Room, Red Green Beige, 15 Feet by 7 Inches KT8300B",B07RSSJTBK,,,18.22,,,,,,0,0,0,0,0,0,8300 KT B,KT8300B
2998,"CONCORD WALLCOVERINGS ? Wallpaper Border Floral Pattern Flowers and Leaves for Bedroom Living Room Cottage Beige, Green, Brown, White 15 ft by 7 in KT8303B",B08Y63CRYD,,,18.77,,,,,,1,0,0,0,0,20,8303 KT B,KT8303B_
2999,"CONCORD WALLCOVERINGS Wallpaper Border Garden Pattern Fruits Leaves for Cottage Farmhouse Dining Area, Brown Orange Green Blue Purple, 10.35 Inches by 15 Feet KT8355B",B09LFJ5CS7,,,18.22,,,,,,0,0,0,0,0,0,8355 KT B,KT8355B
3000,"CONCORD WALLCOVERINGS ? Wallpaper Border Garden Pattern Vine Fruits Leaves Grapes Pears Peaches for Kitchen Dining Area Cottage, Purple Red Green Brown Persian Orange, 10.5 Inches by 15 Feet KT8356B",B09CHCZRML,,,18.77,,,,,,0,0,0,0,0,0,8356 KT B,KT8356B_
3001,"Wallpaper Border Flowers Roses Green Pink Beige Classic 15' x 5.75"" 31616170",B07RSSLR75,,,18.22,,,,,,12,0,0,0,0,4,31616170,KT8388B
3002,"CONCORD WALLCOVERINGS ? Elegant Birdhouses Wallpaper Border Featuring Birds in a Garden Flowers Cages Plants, Colors Beige Green White Yellow, Size 10.5 Inches by 15 Feet KT8467B",B07RRQQ64F,,,18.22,,,,,,0,0,0,0,0,0,8467 KT B,KT8467B_
3003,"CONCORD WALLCOVERINGS ? Retro Garden Wallpaper Border Featuring Birds Cages, Colors Beige Green White, Size 10.5 Inches by 15 Feet KT8468B",B07RSSND5Z,,,18.22,,,,,,0,0,0,0,0,0,8468 KT B,KT8468B_
3004,"Floral Pattern Wallpaper Border Spring Flower Branches for Living Room Bedroom, Colors Pastel Green Pink White, Size 4.25 Inch by 15 Ft KT8522B /O",B08T21BR87,,,18.22,,,,,,0,0,0,0,0,21,8522 KT B,KT8522B_
3005,"CONCORD WALLCOVERINGS ? Wallpaper Border Kitchen Pattern Dishes on Shelf for Dining Area, Beige White Light Green Blue Red, 9.75 Inches by 15 Feet KT8553B",B09NCGF1HN,,,18.77,,,,,,0,0,0,0,0,0,8553 KT B,KT8553B_
3006,9 1/2 in x 15 ft Prepasted Wallpaper Borders - Kitchen Wall Paper Border KT8554B,B07KMN4QPF,,,18.22,,,,,,0,0,0,0,0,0,8554 KT B,KT8554B
3007,"CONCORD WALLCOVERINGS ? Wallpaper Border Kitchen Pattern Sliced Apple Pear Peach Watermelon on Table, Beige Brown Red Blue Green, 5 Inches by 15 Feet 30902340",B09F6ZFZL7,,,18.77,,,,,,0,0,0,0,0,0,30902340,30902340_.
3008,"CONCORD WALLCOVERINGS ? Wallpaper Border Floral Pattern Flowers Leaves one Side Die-Cut for Living Room Bedroom, Cordovan Green Brown Beige White, 6.75 Inches by 15 Feet KT8559B",B09ZDCS2P2,,,18.22,,,,,,0,0,0,0,0,1,8559 KT B,KT8559B ASIN: B09ZDCS2P2
3009,York Wallpaper Wallcovering Girl Power 2 PW4010B,B00K37PD3Y,,,17.22,,,,,,0,0,0,0,0,0,Eades PW4010B,KU-H29A-66ES
3010,"CONCORD WALLCOVERINGS Wallpaper Border Vintage Pattern Coffee Cups Words for Kitchen Cottage Farmhouse, Black Gray, 15 ft by 5.2 in KV79530",B0BKB2GY3N,,,18.77,,,,,,6,0,0,0,0,0,79530 KV,KV79530_
3011,"CONCORD WALLCOVERINGS ? Wallpaper Border Floral Pattern Plants in Pots for Kitchen Farmhouse Cottage, Blue Green Pink Brown, 15 ft by 5 in KV79531",B09L55D7B9,,,18.22,,,,,,5,0,0,0,0,0,79531 KV,KV79531_
3012,"CONCORD WALLCOVERINGS Wallpaper Border Vintage Pattern Flowerpots Words for Kitchen Cottage Farmhouse, Blue Green, 15 ft by 5.3 in KV79532",B0BKB8G1VY,,,18.77,,,,,,6,0,0,0,0,0,79532 KV,KV79532_XX
3013,"CONCORD WALLCOVERINGS Wallpaper Border Vintage Pattern Flowerpots Words for Kitchen Cottage Farmhouse, Yellow Green Brown, 15 ft by 5.3 in KV79533",B0BKB118SW,,,18.77,,,,,,6,0,0,0,0,0,79533 KV,KV79533_
3014,"CONCORD WALLCOVERINGS ? Wallpaper Border Garden Pattern Flowerpots for Farmhouse Cottage Kitchen, White Brown Green Purple Pink, 15 ft by 5 in KV79535",B09M1VDL8P,,,18.22,,,,,,0,0,0,0,0,0,79535 KV,KV79535_
3015,Fruits Wallpaper Border 30902350,B00RI0JDUI,,,18.22,,,,,,0,0,0,0,0,2,30902350,30902350_
3016,"CONCORD WALLCOVERINGS ? Wallpaper Border Vintage Pattern Smiling Moon Sun for Play Room Bedroom, Red Yellow Black, 15 ft by 7 in KW7774B",B09KNTKZ9L,,,18.77,,,,,,3,0,0,0,0,2,7774 KW B,KW7774B_
3017,"CONCORD WALLCOVERINGS ? Wallpaper Border Abstract Pattern Squares for Kitchen Bathroom Bedroom Dining Area, Green Yellow Red, 15 ft by 5 in CT78160",B07RJTJCBL,,,18.22,,,,,,0,0,0,0,0,0,78160 CT,KY-RU66-6D4E
3018,York Wallpaper Wallcovering Border Portfolio ZB3426BD,B00K370Y42,,,18.22,,,,,,1,0,0,0,0,3,Eades ZB3426BD,KZ-1BIR-9LX6
3019,"CONCORD WALLCOVERINGS ? Wallpaper Border Kids Pattern Fish Circus Jellyfishes Octopus Corals for Kid's Bedroom Playroom, Black Green Blue Orange Lilac, 15 Feet by 13.6 Inches KZ1063B",B0BHFH5HXF,,,18.77,,,,,,6,0,0,0,0,0,1063 KZ B,KZ1063B_
3020,"CONCORD WALLCOVERINGS ? Kids Wall Stickers Sea World Fish Octopus Dolphins Design for Play Room Bedroom, Blue Green Yellow, KZ1072C",B09R2M66LR,,,18.22,,,,,,0,0,0,0,0,0,1072 KZ,KZ1072C_
3021,"CONCORD WALLCOVERINGS ? Kids Wall Stickers Sea World Fish Octopus Dolphins Design for Play Room Bedroom, Blue Green Yellow Black, KZ1073C",B09R2LR1VC,,,17.22,,,,,,0,0,0,0,0,0,1073 KZ,KZ1073C_
3022,"CONCORD WALLCOVERINGS Wallpaper Border Kids Pattern Painting Butterflies Hearts for Girl's Bedroom Playroom, Blue Purple Pink Green Orange, 15 Feet by 9 Inches KZ1124",B0BFFWJN6N,,,18.77,,,,,,6,0,0,0,0,0,1124 KZ,KZ1124_
3023,"CONCORD WALLCOVERINGS Wallpaper Border Kids Pattern Painting Butterflies Hearts for Girl's Bedroom Playroom, Green Red Blue Yellow, 15 Feet by 9 Inches KZ1125",B0BFFZNJHC,,,18.77,,,,,,6,0,0,0,0,0,1125 KZ,KZ1125_
3024,"CONCORD WALLCOVERINGS Wallpaper Border Kids Pattern Painting Butterflies Hearts for Girl's Bedroom Playroom, Yellow Pink Purple Green, 15 Feet by 9 Inches KZ1126",B0BFFZ5NHN,,,18.77,,,,,,6,0,0,0,0,0,1126 KZ,KZ1126_
3025,Smiling Sun Moon Purple Clouds KZ1193B Wallpaper Border,B07FZSV2Q4,,,18.22,,,,,,0,0,0,0,0,2,KZ1193B-GP,KZ1193B_
3026,"CONCORD WALLCOVERINGS ? Wallpaper Border Sky Pattern Sun Moon Stars Clouds, Die Cut Edge for Kid's Bedroom Playroom, Purple Pink Blue Yellow, 15 Feet by 10.5 Inches KZ1193",B0BFFTVSRL,,,18.77,,,,,,0,0,0,0,0,0,1193 KZ,KZ1193_
3027,"Noah's Arc Animals Blue Wallpaper Border Retro Design, Roll 15' x 10""",B07B1S226M,,,18.22,,,,,,0,0,0,0,0,0,KZ1221B,KZ1221B
3028,"CONCORD WALLCOVERINGS Wallpaper Border Faith Pattern Noah's Arc Animals for Kid's Bedroom Cottage Bedroom, Green Blue Orange Pink Gray, 10 Inches by 15 Feet KZ1221",B0BFG1KWD6,,,18.77,,,,,,1,0,0,0,0,0,1221 KZ,KZ1221_
3029,"CONCORD WALLCOVERINGS ? Wallpaper Border Kids Pattern Cars Trucks Excavators, Die Cut Edges for Boy's Bedroom Playroom, Yellow Brown Blue, 15 Feet by 9 Inches KZ1242B",B0BG6BJRBT,,,18.77,,,,,,6,0,0,0,0,0,1242 KZ B,KZ1242B_XX
3030,"CONCORD WALLCOVERINGS Wallpaper Border Kids Pattern Cars Trucks Excavators, Die Cut Edges for Kid's Bedroom Playroom, Black Brown Green, 15 Feet by 9 Inches KZ1243B",B0BFZGPBTC,,,18.55,,,,,,6,0,0,0,0,0,1243 KZ B,KZ1243B_
3031,"CONCORD WALLCOVERINGS Wallpaper Border Sports Pattern Baseball Basketball Tennis Soccer Ball Basket Glove Bat for Kid's Bedroom Playroom, Brown Green Red Blue, 15 Feet by 9 Inches KZ1252B",B0BG644X5X,,,18.77,,,,,,0,0,0,0,0,0,1252 KZ B,KZ1252B_XX
3032,"CONCORD WALLCOVERINGS ? Wallpaper Border Hearts Pattern Butterflies Swirls for Kid's Bedroom Playroom, Pink Blue Yellow Green, 15 Feet by 9.3 Inches KZ1293B",B07FZRL4SM,,,18.22,,,,,,0,0,0,0,0,6,KZ1293B-GP,KZ1293B
3033,"CONCORD WALLCOVERINGS ? Wallpaper Border Hearts Pattern Butterflies Swirls for Kid's Bedroom Playroom, Pink Blue Yellow Green, 15 Feet by 9.3 Inches KZ12893B",B0BG673X4L,,,18.77,,,,,,0,0,0,0,0,0,1293 KZ B,KZ1293B_XX
3034,"CONCORD WALLCOVERINGS Wallpaper Border Berry Pattern Strawberries Flowers Leaves Words for Cottage Kitchen Dining Room, Beige Red Green Yellow, 7 Inches by 15 Feet RY3288B",B07NTQJN3C,,,18.77,,,,,,0,0,0,0,0,41,3288 RY B,L0-GLXZ-F05I
3035,"Ducks in the Lake Wallpaper Border Retro Design, Roll 15' x 6''",B0778R2BCN,,,18.99,,,,,,6,0,0,0,0,4,WE623B,L1-EU8Z-UQXX
3036,"Hunters with Lasso Rope Bull Vintage Wallpaper Border Retro Design, Roll 15' x 10.25''",B076BV72VB,,,18.22,,,,,,0,0,0,0,0,0,IN2648B,L6-BVHP-QC0B
3037,York Wallpaper Wallcovering Border Portfolio ZB3425BD,B00K370Z32,,,18.99,,,,,,0,0,0,0,0,0,Eades ZB3425BD,L8-1SAX-T2C2
3038,Norwall AW77375 Wallpaper Border Kitchen Living,B00457YSPC,,,18.66,,,,,,10,0,0,0,0,4,AW77375,L8-6UYN-R3UL
3039,TIMBER CREEK LODGE Wallpaper -TC48113B Wallpaper,B002LDLA62,,,17.22,,,,,,0,0,0,0,0,0,48113 TC B,LA-FYDF-EITK
3040,"CONCORD WALLCOVERINGS Wallpaper Border Nautical Pattern Sea Clouds Sail Boats for Cottage Beach House, Blue, 15 ft by 7 in SM597B",B07SB7W3MS,,,18.77,,,,,,0,0,0,0,0,0,597 SM B,LA-QHX7-3SEE
3041,"CONCORD WALLCOVERINGS ? Wallpaper Border Kitchen Pattern Teapot Cups Plates for Kitchen Dining Area Cottage, Green Brown White Beige, 15 ft by 7 in LA036212B",B09L59SQJH,,,18.22,,,,,,3,0,0,0,0,4,36212 LA B,LA036212B_
3042,"CONCORD WALLCOVERINGS ? Wallpaper Border Fruits Pattern Pears Apples Grapes Plums Leaves, Die Cut Edge for Kitchen Cottage Dining Area, Red Violet Yellow Blue Green, 7.5 Inches by 15 Feet LA15017DB",B0B94MC8D4,,,18.77,,,,,,1,0,0,0,0,0,15017 LA DB,LA15017DB_
3043,"CONCORD WALLCOVERINGS ? Wallpaper Border Plant Pattern Leaves Berries for Bedroom Kitchen Cottage, Green Beige Red Burgundy, 15 ft by 7 in LA3849B",B091BJCZZV,,,18.22,,,,,,0,0,0,0,0,0,3849 LA B,LA3849B_
3044,"CONCORD WALLCOVERINGS ? Wallpaper Border Abstract Pattern Vine Leaves for Kitchen Bedroom Living Room, Red Gold, 15 ft by 5 in LA3979B",B09J1K4JK1,,,18.22,,,,,,0,0,0,0,0,0,3979 LA B,LA3979B_
3045,"CONCORD WALLCOVERINGS ? Wallpaper Border Vintage Pattern Leopard Fabric Folds Floral Decorative Elements for Bedroom Living Room, Burgundy Brown Gold Green Blue, 5 Inches by 15 Feet LAB5101",B0BDPNKF7H,,,18.77,,,,,,0,0,0,0,0,0,5101 LAB,LAB5101_
3046,Wallpaper Border - 30992910 Kids Wallpaper Border,B00IYWYC5A,,,18.22,,,,,,0,0,0,0,0,0,30992910,30992910_
3047,"CONCORD WALLCOVERINGS ? Wallpaper Border Sport Pattern Lacrosse Game Gloves Helmet Shoes Balls for Home Gym Teenagers Bedroom, Blue Yellow Red Black Grey, 7 Inches by 15 Feet LAX1000B",B09FB1FVZV,,,18.77,,,,,,0,0,0,0,0,0,1000 LAX B,LAX1000B_.
3048,"CONCORD WALLCOVERINGS ? Wallpaper Border Fruits Pattern Apples Leaves Hearts, Die Cut Edge for Kitchen Dining Area Cottage, Green Red Orange Brown, 4 Inches by 15 Feet LB0220DB",B0BBPCYMHQ,,,18.77,,,,,,0,0,0,0,0,0,0220 LB DB,LB0220DB_
3049,6 1/2 in x 15 ft Prepasted Wallpaper Borders - Fruits Wall Paper Border WL5577B,B07KMWJSS7,,,18.22,,,,,,0,0,0,0,0,0,WL5577B,LC-9SFX-M7QE
3050,10 1/4 in x 15 ft Prepasted Wallpaper Borders - Roosters Wall Paper Border KH5919B,B07JJM7MZ2,,,18.22,,,,,,0,0,0,0,0,0,KH5919B,LC-J0I6-91MG
3051,"Berries in Basket Vintage Wallpaper Border Retro Design, Roll 15' x 7''",B076HYFRRZ,,,18.22,,,,,,0,0,0,0,0,0,BP007173B,LD-RY1Y-T72Y
3052,"CONCORD WALLCOVERINGS ? Wallpaper Border Fruit Pattern Apples Pears Grapes Cherries Raspberries for Cottage Kitchen Dining Room, Beige Red Blue Green, 15 Feet by 9 Inches LF3123B",B07S32ZDH6,,,18.22,,,,,,0,0,0,0,0,4,3123 LF B,LF3123B
3053,"CONCORD WALLCOVERINGS ? Wallpaper Border Floral Pattern Flowers Leaves for Cottage Farmhouse Dining Area, Brown Beige Green Purple, 15 ft by 13 in LG3324B",B09MX9BLJ6,,,18.22,,,,,,0,0,0,0,0,0,3324 LG B,LG3324B_XX
3054,Vintage Purple White Flowers LG3325B Wallpaper Border,B07FZSWXSX,,,18.22,,,,,,0,0,0,0,0,0,LG3325B-GP,LG3325B_
3055,"CONCORD WALLCOVERINGS ? Wallpaper Border Kids Pattern Beads Pearls Mirror Ribbons for Girl's Bedroom Play Room, Light Pink Silver, 16.4 ft by 10.5 in 009710",B0BTMRPZXC,,,18.77,,,,,,6,0,0,0,0,0,9710,009710_
3056,"CONCORD WALLCOVERINGS ? Wallpaper Border Kids Pattern Scheckers and Chess Boards Playboards for Playroom Kid's Room Living Room, Brown Beige Red, 15 Feet by 9 Inches 30992910",B0BHF8Z7TQ,,,18.77,,,,,,6,0,0,0,0,0,30992910,30992910_XX
3057,"CONCORD WALLCOVERINGS Wallpaper Border Floral Pattern Flowers Leaves Ornaments for Bedroom Living Room, Brown Green Red, 15 Feet by 13.5 Inches LG3326B",B07S8YCCF8,,,18.77,6,,,,,0,0,0,0,0,0,3326 LG B,LG3326B
3058,"CONCORD WALLCOVERINGS Wallpaper Border Vintage Pattern Flowers Leaves Ornaments for Cottage Bedroom Living Room, Brown Green Red, 15 Feet by 13.5 Inches LG3327B",B07SF9KP47,,,18.77,,,,,,0,0,0,0,0,0,3327 LG B,LG3327B
3059,"CONCORD WALLCOVERINGS Wallpaper Border Art Pattern Geometric Figures Lines for Cottage Living Room, Brown Burgundy Gray, 7 Inches by 15 Feet UE919B",B07RYZZGZF,,,18.22,,,,,,0,0,0,0,0,0,919 UE B,LH-A75C-4687
3060,York Wallpaper Wallcovering Cool Kids KS2226B,B00K36WOJQ,,,17.22,,,,,,0,0,0,0,0,0,Eades KS2226B,LH-IHDH-G7W7
3061,Wallpaper For Less LH2002B Wooden Dark Column Wallpaper Border,B008I6X1PO,,,18.22,,,,,,0,0,0,0,0,0,LH2002B,LH2002B_
3062,"CONCORD WALLCOVERINGS ? Wallpaper Border Vintage Pattern Wooden Column with Ornament, Die Cut Edge for Kitchen Cottage Farmhouse, Brown Green, 15 Feet by 3.5 Inches LH2002B",B0BHFCMP8T,,,18.77,,,,,,6,0,0,0,0,0,2002 LH B,LH2002B_XX
3063,"CONCORD WALLCOVERINGS ? Wallpaper Border Vintage Pattern Garden Supplies Flowers in Pots for Cottage Kitchen Farmhouse, Cream Red Green Blue, 15 ft by 9 in 31052210",B09RLZDY11,,,18.22,,,,,,1,0,0,0,0,3,31052210,31052210_
3064,"CONCORD WALLCOVERINGS Wallpaper Border Floral Pattern Flowers Leaves Birds for Cottage Kitchen Dining Room Bedroom Living Room, Red Green Yellow Purple, 15 Feet by 10.25 Inches LH2032B",B07RRQYXR8,,,18.22,,,,,,0,0,0,0,0,1,2032 LH B,LH2032B
3065,"CONCORD WALLCOVERINGS Wallpaper Border Floral Pattern Flowers Leaves Parrots for Cottage Bedroom Living Room, Cream Green Red, 15 Feet by 10.25 Inches LH2034B",B07RPP7BF5,,,18.77,,,,,,1,0,0,0,0,6,2034 LH B,LH2034B
3066,"CONCORD WALLCOVERINGS Wallpaper Border Kids Pattern Africa Monkeys Palms for Kid's Bedroom Playroom, Green Brown Blue Red Yellow, 15 Feet by 10.25 Inches LH2114B",B07RPP6VZX,,,18.22,,,,,,0,0,0,0,0,7,2114 LH B,LH2114B
3067,"CONCORD WALLCOVERINGS Wallpaper Border Animal Pattern Monkeys Palms for Cottage Kid's Bedroom Playroom, Beige Green, 15 Feet by 10.5 Inches LH2115B",B07RTZ4X8W,,,18.77,,,,,,0,0,0,0,0,2,2115 LH B,LH2115B
3068,"Yellow Flowers Rosewood Pink Vintage Floral Wallpaper Border Paint by Design, Roll 15' x 7''",B07629F78S,,,18.22,,,,,,0,0,0,0,0,0,2160 LH B,LH2160B
3069,"CONCORD WALLCOVERINGS Wallpaper Border Floral Pattern Flowers Leaves for Cottage Bedroom Living Room, Beige Red Green, 15 Feet by 7 Inches LH2164B",B07QHZZX2D,,,18.22,,,,,,0,0,0,0,0,0,2164 LH B,LH2164B_
3070,"CONCORD WALLCOVERINGS ? Prepasted Wallpaper Border Fruits in a Frame Apples Pears Grapes, Colors Red Beige Brown, Size 9 Inches by 15 Feet DB3781B",B07RMC2BT4,,,18.22,,,,,,0,0,0,0,0,107,3781 DB B,LJ-QNKQ-ANUW
3071,"CONCORD WALLCOVERINGS Wallpaper Border Cartoon Pattern River Ducklings for Kid's Bedroom Playroom, Blue Green YellowPurple Pink, 15 Feet by 7 Inches LK1435B",B07S4CC8SZ,,,18.22,,,,,,0,0,0,0,0,0,1435 LK B,LK1435B
3072,"CONCORD WALLCOVERINGS ? Wallpaper Border Kids Pattern Painted Little Ducks in The Pond for Nursery Room Kid's Bedroom Playroom, Blue Yellow Green Purple, 15 Feet by 7 Inches LK1437",B0BHFDQ5QY,,,18.77,,,,,,6,0,0,0,0,0,1437 LK,LK1437_
3073,"Decorative Pre-Pasted Wallpaper Border Two Sided Laser Cut, Kids Style Baby's Happy Stuffed Animals Friends, Colors Pastels Green Yellow Pink Biege Brown, 10 Inch by 15 Ft LK1439B /O",B08NRK31MT,,,18.99,,,,,,0,0,0,0,0,12,1439 LK,LK1439B_
3074,"CONCORD WALLCOVERINGS ? Wallpaper Border Modern Abstract Pattern for Living Room Bedroom, Colors Blue Pink White Purple, Size 7 Inches by 15 Feet LK1635B",B093QP7LV6,,,18.77,,,,,,0,0,0,0,0,0,1635 LK B,LK1635B_
3075,"CONCORD WALLCOVERINGS ? Wallpaper Border Abstract Pattern Tie Dye for Bedroom Living Room, Green Beige Brown Burnt Red, 7 Inches by 15 Feet LK1636B",B09KNYLYQT,,,18.77,,,,,,0,0,0,0,0,0,1636 LK B,LK1636B_
3076,"CONCORD WALLCOVERINGS ? Kids Wallpaper Border Nature Pattern Camp Wintertime Wild Animals for Play Room Nursery Room, Blue White Green Orange, 15 ft by 18 in LK8201BD",B09JGSZDWB,,,18.22,,,,,,0,0,0,0,0,0,8201 LK BD,LK8201BD_
3077,"Concord Wallcoverings Wallpaper Border Kids Pattern Industrial City Cartoon Vehicles Taxi School Bus Fire Toe Truck Ambulance for Boys Room, Grey Green Red White Yellow, 18 Inches by 15 Feet LK8211BD",B09JHM78SQ,,,18.77,,,,,,0,0,0,0,0,0,8211 LK BD,LK8211BD_
3078,"CONCORD WALLCOVERINGS ? Wallpaper Border Sport Pattern Best in The Field, Colors Green Dark Blue Grey White, Size 9 Inches by 15 Feet LK8226BD",B08XYBXBHH,,,18.77,,,,,,0,0,0,0,0,1,8226 LK BD,LK8226BD_
3079,"CONCORD WALLCOVERINGS ? Wallpaper Border Sport Pattern The Best in The Field for Teen Room Home Gymnastic Room Gym, Colors White Dark Blue Grey Red, Size 9 Inches by 15 Feet LK8227BD",B08Y3DKK9Q,,,18.77,,,,,,0,0,0,0,0,0,8227 LK BD,LK8227BD_
3080,York Wallcoverings Best In The Field Border - Black/Beige/White/Off White |Spray with Water and Hang | Ultra Easy,B07F6RSQFP,,,18.22,,,,,,0,0,0,0,0,0,LK8228BD,LK8228BD_
3081,"CONCORD WALLCOVERINGS Wallpaper Border Kids Pattern Football Field Players for Kid's Room Bedroom Playroom, Black Gray, 15 ft by 6.7 in LK8228BD",B0BK9Z9YH6,,,18.77,,,,,,6,0,0,0,0,0,8228 LK BD,LK8228BD_XX
3082,"CONCORD WALLCOVERINGS ? Kids Wallpaper Border Ships Sea Sky for Play Room Bedroom Bathroom, Blue Red White, 15 Ft by 6 in LK8235BD",B09R3H2DCJ,,,18.22,,,,,,0,0,0,0,0,0,8235 LK,LK8235BD_1_
3083,"CONCORD WALLCOVERINGS ? Karavi Wallpaper Border Blue, Yellow, Green, Black 6 Inches by 15 Feet LK8236BD",B08XN3J5ZP,,,18.77,,,,,,0,0,0,0,0,0,8236 LK BD,LK8236BD_
3084,"CONCORD WALLCOVERINGS ? Wallpaper Border Garden Rabbit Border for Kids Room, Colors Blue White Beige Green, Size 9 Inches by 15 Feet LK8270BD",B08XN215JG,,,18.77,,,,,,5,0,0,0,0,0,8270 LK BD,LK8270BD_
3085,"CONCORD WALLCOVERINGS ? Wallpaper Border Kids Pattern Field Rabbits Flowers Mushrooms Snail for Baby Boy Nursery Room Daycare Playroom, White Beige Grey Green Turquoise, 9 Inches by 15 Feet LK8271BD",B09JXP4B4X,,,18.77,,,,,,0,0,0,0,0,3,8271 LK BD,LK8271BD_
3086,York Wallcoverings Garden Frolic Border - Purple/Green/Beige |Spray with Water and Hang | Ultra Easy,B07F6VJ2VW,,,18.22,,,,,,0,0,0,0,0,0,LK8272BD,LK8272BD_
3087,"CONCORD WALLCOVERINGS ? Wallpaper Border English Alphabet for Kids, Colors Light Blue Yellow Grey Orange Green, Size 9 Inches by 15 Feet LK8281BD",B08Y3DKHC9,,,18.77,,,,,,0,0,0,0,0,1,8281 LK BD,LK8281BD_
3088,"CONCORD WALLCOVERINGS ? Wallpaper Border Swimming Swans for Kitchen or Dining Area, Colors Light Yellow Black Grey, Size 6 Inches by 15 Feet LK8295BD",B08ZBJKQFN,,,18.77,,,,,,0,0,0,0,0,0,LK8295BD,LK8295BD..
3089,York Wallcoverings Swimming Swans Border - Pink/Black/White/Off White |Spray with Water and Hang | Ultra Easy,B07F6VLPL5,,,18.22,,,,,,0,0,0,0,0,0,LK8296BD,LK8296BD_
3090,"CONCORD WALLCOVERINGS Wallpaper Border Kid's Pattern Swans for Kid's Bedroom Playroom, Pink White, 15 ft by 6 in LK8296BD",B0BK3HHKCZ,,,18.77,,,,,,6,0,0,0,0,0,8296 LK BD,LK8296BD_XX
3091,"CONCORD WALLCOVERINGS ? Wallpaper Border Kids Pattern Swimming Swans for Kid's Room Play Room, Blue Black White, 15 ft by 6 in LK8297BD",B08XN3M5LC,,,18.77,,,,,,0,0,0,0,0,0,8297 LK BD,LK8297BD_
3092,"Imperial 4-1/8"" Classical Braid Prepasted Wallpaper Border",B004Q0CE40,,,18.22,,,,,,0,0,0,0,0,0,081141 LL B,LL081141B
3093,"CONCORD WALLCOVERINGS ? Wallpaper Border Poker Pattern Game Board Chips Dice for Dining Area Casino, Blue Green Red Saffron Black, 7 Inches by 15 Feet LL50112B",B09FCSSVPG,,,18.77,,,,,,0,0,0,0,0,0,50112 LL B,LL50112B_
3094,"CONCORD WALLCOVERINGS ? Wallpaper Border Travel Pattern Yellowstone Colorado Rio Grande Lodge Posters for Living Room Social Room Cottage, Multicolored, 9.5 Inches by 15 Feet LM9030B",B09G8PFBKZ,,,18.77,,,,,,0,0,0,0,0,0,9030 LM B,LM9030B._
3095,"Norwall Forest on The River Ducks Blue Sky Realistic Nature Wallpaper Border Retro Design, Roll 15' x 7''",B0778NHJJS,,,18.77,,,,,,0,0,0,0,0,2,GL76354N,LN-74U7-GL41
3096,Blue 5813720B Hanging Laundry Wallpaper Border 5813720,B00IN0WGJ2,,,18.11,,,,,,1,0,0,0,0,75,5813720,LN-H63H-T0SP
3097,9 in x 15 ft Prepasted Wallpaper Borders - Lighthouse Wall Paper Border HF8512B,B07KMWLXPW,,,18.22,,,,,,0,0,0,0,0,0,HF8512B,LP-HSQL-KY18
3098,"Vintage Black Row Boat Trees on Brown Wallpaper Border Retro Design, Roll 15' x 9""",B07B1V3NY1,,,18.22,,,,,,0,0,0,0,0,3,WL5622B,LR-CYBN-KIKV
3099,7 in x 15 ft Prepasted Wallpaper Borders - Kitchen Wall Paper Border RB360B,B07KMWPH7Y,,,18.22,,,,,,0,0,0,0,0,0,RB360B,LR-TZA8-DZ94
3100,Red Blue Wreath Flowers Hanging Beige FFM10083B Wallpaper Border,B07FZQVW55,,,18.22,,,,,,0,0,0,0,0,6,FFM10083B-GP,LS-XIRX-DASH
3101,Tan and White Architectural Wallpaper Border,B001UXVMS0,,,18.96,,,,,,0,0,0,0,0,11,75591DL    Lot 6A,LT-SQVC-JWN7
3102,"CONCORD WALLCOVERINGS ? Kids Wallpaper Border Cartoon Rabbit for Play Room Nursery Room, Purple White Brown Blue, 15 Ft by 7 in LT7152B",B09R2NQH8T,,,18.22,,,,,,0,0,0,0,0,0,7152 LT,LT7152B_1_
3103,"CONCORD WALLCOVERINGS Wallpaper Border Garden Pattern Fence Flovers Leaves Butterflies Bird Houses for Cottage Farmhouse Living Room, Red Green Blue Purple, 15 Feet by 10 Inches 31326410",B08QTX3BH4,,,18.77,,,,,,6,0,0,0,0,10,31326410,31326410_
3104,9 in x 15 ft Prepasted Wallpaper Borders - Jungle Animals Wall Paper Border LT9415B,B07JHV4LFT,,,18.22,,,,,,0,0,0,0,0,0,LT9415B,LT9415B
3105,"CONCORD WALLCOVERINGS Wallpaper Border Animal Pattern Circus Monkeys Leopards Flowers, Die Cut Edge for Living Room Bathroom Kids Room School, Beige Blue Gold Red Brown, 15 Feet by 9.5 Inches LT9415B",B0BKH7LT2C,,,18.77,,,,,,6,0,0,0,0,0,9415 LT B,LT9415B_X_
3106,8 1/2 in x 15 ft Prepasted Wallpaper Borders - Leaves Wall Paper Border LT9467B,B07KMWL763,,,18.22,,,,,,0,0,0,0,0,0,LT9467B,LT9467B
3107,"CONCORD WALLCOVERINGS ? Wallpaper Border Fruit Pattern Pineapples Leaves for Cottage Kitchen Dining Area, Yellow Green Pink, 15 ft by 7 in LT9469B",B07RRR7LSJ,,,18.22,,,,,,0,0,0,0,0,0,9469 LT B,LT9469B
3108,"Wallpaper Border Pineapple Leaves Red Beige Classic 15' x 8"" LT9470B",B07S8QXVCM,,,18.22,,,,,,0,0,0,0,0,0,9470 LT,LT9470B_
3109,9 in x 15 ft Prepasted Wallpaper Borders - Pineapple Fruits Wall Paper Border LT9471B,B07JWLFK1Q,,,18.22,,,,,,0,0,0,0,0,0,LT9471B,LT9471B
3110,"CONCORD WALLCOVERINGS Wallpaper Border Floral Pattern Pineapples Leaves Tropical for Kitchen Dining Room Living Room, Beige Green Red Gold, 15 Feet by 8.5 Inches LT9471B",B0BKH6MPCN,,,18.77,,,,,,6,0,0,0,0,0,9471 LT B,LT9471B__
3111,"CONCORD WALLCOVERINGS ? Wallpaper Border Floral Pattern Florals Leaves Abstract Rhombuses, Die Cut Edge, for Bedroom Living Room Powder Room, Pink Green White, 15 Feet by 9 Inches LT9609B",B09KS6QZHK,,,18.22,,,,,,6,0,0,0,0,0,9609 LT B,LT9609B_
3112,"Brown Curtain Ties on Blue Traditional Wallpaper Border Retro Design, Roll 15' x 5''",B0764JPCJT,,,18.22,,,,,,0,0,0,0,0,0,113 LW B,LW113B
3113,"CONCORD WALLCOVERINGS ? Wallpaper Border Kids Pattern Wooden Rocking Horse for Nursery Room, Blue Pink Brown, 7 Inches by 15 Feet LW79178",B097TVQWXX,,,18.77,,,,,,0,0,0,0,0,0,79178 LW,LW79178_
3114,Vintage Wallpaper Border TT5202B,B07KMWBKGC,,,18.22,,,,,,0,0,0,0,0,0,TT5202B,LZ-LQ1J-OYL3
3115,"CONCORD WALLCOVERINGS ? Wallpaper Border Kids Pattern Beads Pearls Mirror Ribbons for Girl's Bedroom Play Room, Red Pink Blue, 16.4 ft by 10.5 in 009750",B0BTMQFRSV,,,18.77,,,,,,6,0,0,0,0,0,9750,009750_
3116,Patton Wallpaper Wallcovering Pretty Prints 3 PP79058,B00K36XB1G,,,18.22,,,,,,0,0,0,0,0,0,Eades PP79058,M0-7B0I-9J9P
3117,7 in x 15 ft Prepasted Wallpaper Borders - Fruits Wall Paper Border KR2257B,B008OPIKKK,,,18.22,,,,,,0,0,0,0,0,0,KR2257B,M0-WPTS-QW4T
3118,York Wallpaper Wallcovering Candice Olson Kids CK7679B,B00K371HKC,,,17.22,,,,,,0,0,0,0,0,0,Eades CK7679B,M5-C7NB-4V9Q
3119,THE BEST OF KIDS VOL. 1 Wallpaper -ISB4042B Wallpaper,B002LDYNHA,,,18.22,,,,,,0,0,0,0,0,0,4042 ISB B,M6-NO6S-M0PE
3120,Garden Wallpaper Border BA1404B,B07KMX4V24,,,18.22,,,,,,0,0,0,0,0,1,BA1404B,M8-ZQBH-PPEO
3121,"CONCORD WALLCOVERINGS ? Wallpaper Border Vintage Pattern Luxury Drapery for Living Room Bedroom, Cream Black Brown Beige, 15 ft by 11 in MAD3101B",B09R68D9NH,,,18.22,,,,,,1,0,0,0,0,0,3101 MAD B,MAD3101B_
3122,"CONCORD WALLCOVERINGS ? Wallpaper Border Vintage Pattern Curtains Gypsum Elements Marble Details for Cottage Bedroom Living Room, Green Red Blue Yellow Brown, 10.5 Inches by 15 Feet MAD3105B",B0BDGJSPVH,,,18.77,,,,,,0,0,0,0,0,0,3105 MAD B,MAD3105B_
3123,9 1/4 in x 15 ft Prepasted Wallpaper Borders - Kitchen Wall Paper Border DB3780B,B07JJCDGJB,,,18.66,,,,,,0,0,0,0,0,0,DB3780B,MB-KH4O-4RLH
3124,6 in x 15 ft Prepasted Wallpaper Borders - Outdoor Wall Paper Border MCB5303,B00RI1JPBE,,,18.22,,,,,,6,0,0,0,0,2,5303 MCB,MCB5303
3125,"CONCORD WALLCOVERINGS Wallpaper Border Vintage Pattern River Boats Hills Lighthouses Balloons for Cottage Farmhouse Living Room, Gray Green Red, 15 ft by 7 in MCB5303",B0BK9YWRVF,,,18.77,,,,,,6,0,0,0,0,0,5303 MCB,MCB5303_XX
3126,Patton Wallpaper Wallcovering Floral Prints PF79505,B00K378P16,,,18.22,,,,,,0,0,0,0,0,0,Eades PF79505,MD-UE87-M9N5
3127,"CONCORD WALLCOVERINGS ? Wallpaper Border Vintage Pattern Vegetables for Kitchen Cottage, Black Green Red, 15 ft by 9 in MD143B",B08TFB7R55,,,18.77,,,,,,0,0,0,0,0,1,143 MD B,MD143B_
3128,7 in x 15 ft Prepasted Wallpaper Borders - Floral Wall Paper Border MD201B,B07KMVNFBT,,,18.22,,,,,,0,0,0,0,0,8,201 MD B,MD201B
3129,"CONCORD WALLCOVERINGS ? Wallpaper Border Damask Pattern Ornament Flowers Leaves for Living Room Bedroom Dining Area Bathroom, Blue Beige Red Brown Green, 15 Feet by 6.9 Inches MD201B",B0BHFBFJR5,,,18.77,,,,,,6,0,0,0,0,0,201 MD B,MD201B_XX
3130,"CONCORD WALLCOVERINGS Wallpaper Border Vintage Pattern Ornaments Flowers Drapes for Kitchen Dining Room Bedroom, Blue Pink Brown, 15 Feet by 7 Inches MD242B",B0BJMLLWRB,,,18.77,,,,,,2,0,0,0,0,0,242 MD B,MD242B_
