id,Title,ASIN,SHP,N_Price,Price,1_W,2_W,3_W,4_W,Inbound,Inv,30,60,90,12m,2000-2025,Parts__Num,SKU
1,"CONCORD WALLCOVERINGS ? Wallpaper Border Floral Pattern Spring Blossom Flowers Tree Brunches for Bedroom Living Room, Brown White Green, 15 Feet by 7 Inches EG022112B",B08QPZ5L16,24,,18.77,12,12,,,,30,24,46,74,392,609,022112 EG B,EG022112B_
2,"Concord Wallcoverings Classic Beige Wallpaper Border Featuring Marble Cornice Print for Vintage Interior, Size 10.25 Inches by 15 Feet DK1165B",B07RLNWSWZ,24,,18.77,,12,,,,44,6,18,49,247,633,1165 DK B,1A-9TF7-D76W
3,"CONCORD WALLCOVERINGS ? Wallpaper Border Floral Pattern Roses Butterflies for Bedroom Living Room, Beige Pink Blue, 15 Feet by 7 Inches 29427",B07Q6ZT2Q1,,,18.77,24,24,24,,,25,9,33,51,238,408,29427,S5-3T00-TWM5
4,"CONCORD WALLCOVERINGS ? Wallpaper Border Sun and Moon Starry Sky - Great Wall D?cor for Boy or Girl Bedroom, Colors Blue Brown and Silver-Grey, Size 7 Inches by 15 Feet SH79701L",B07QBR57G6,,,18.77,24,12,,,,12,16,43,62,232,1226,SH79701L,Concord_WB_0463
5,"CONCORD WALLCOVERINGS ? Wallpaper Border Patriotic Pattern Country Style for Kitchen Cottage Farmhouse, Cream Red Brown, 15 ft by 7 in BH1108900146",B092514C4G,,,18.77,48,12,12,,,24,16,45,71,225,452,BH1108900146,BH1108900146_
6,CONCORD WALLCOVERINGS ? Wallpaper Border Olive White Molding Swirls 7 Inches by 15'Feet AR77979,B07QBR8B4Q,,,18.77,24,24,,36,,5,29,61,95,221,514,77979 AR,Concord_WB_0580
7,"CONCORD WALLCOVERINGS ? Wallpaper Border Fruits Pattern Apples Leaves for Kitchen Cottage Farmhouse, Cream Red Green, 15 ft by 5 in KT77929",B093MCJXFL,,,18.77,24,,36,,,43,10,44,63,201,368,77929 KT,KT77929_
8,"CONCORD WALLCOVERINGS ? Wallpaper Border Vintage Pattern Greek Ornament for Cottage Bedroom Living Room, Cream Beige, 15 Feet by 7 Inches 777B2200",B07RY67LP5,,,18.77,,12,,,,34,3,3,6,198,299,777B2200,VZ-MYAF-LRTT
9,"CONCORD WALLCOVERINGS ? Classic Kitchen Wallpaper Border Birdhouses Garden, Beige Brown Green Yellow, Size 6.75 Inches by 15 Feet AAI08052B",B07QHYPZTN,,,18.77,24,12,,,,45,8,19,33,192,438,08052 AAI B,Concord_WB_0122
10,"CONCORD WALLCOVERINGS ? Elegant Floral Wallpaper Border Featuring Roses, Colors Creamson Pink and Red, Size 9 Inches by 15 Feet 5811365",B07RLGHNMW,,,18.77,24,,,12,,12,8,31,48,178,255,5811365,5Y-T2Q7-7GA8
11,"CONCORD WALLCOVERINGS ? Wallpaper Border Abstract Pattern Ornaments Leaves for Kitchen Dining Area Cottage Farmhouse Living Room, Grey White, 7 Inches by 15 Feet TT5200B",B0B91YZ726,,,18.22,24,,,12,,22,19,35,62,169,169,5200 TT B,TT5200B_X_
12,"CONCORD WALLCOVERINGS ? Wallpaper Border Floral Pattern Magnolia Blossom for Living Room Bedroom Bathroom, Green Cream Beige, 15 ft by 9 in VG8548B",B07QDPL7XP,,,18.77,24,,,,,2,1,8,24,168,395,8548 VG B,Concord_WB_0946
13,"Better Homes & Gardens Faith, Hope & Love Wallpaper Border",B00MSV1HBA,24,,18.77,,,,24,,2,25,35,51,165,483,BH11-089-001-46,PZ-GS7I-IMMG
14,"York Wallcoverings EB8900B Border Book Coffee Signs Border, Cream/Browns",B002HTO6N4,,,18.99,,,,12,,51,8,20,39,162,909,EB8900B,AF-W1RX-B2RR
15,"Concord Wallcoverings Wallpaper Border Garden Pattern Flowers Pots Leaves Fence Birdhouse Watering Can Barrel for Farmhouse Cottage, Green Blue White Yellow Orange Aqua, 8 Inches by 15 Feet PC95022B",B09MSQPPJ8,,,18.77,,,,12,,47,3,8,23,162,223,95022 PC B,PC95022B_YY
16,"Prepasted Wallpaper Border - Blue White Flowers Scalloped Wall Border Retro Design, Roll 15 ft. x 5 in.",B07L6TSNBK,,,18.55,,,,,,41,0,7,26,155,561,CN76740DL,CN76740DL
17,"CONCORD WALLCOVERINGS ? Wallpaper Border Vintage Victorian Pattern for Living Room Bedroom, Colors Pastel Grey Brown Beige, Size 7 Inches by 15 Feet DK1254B",B09BDC45G2,,,18.77,12,,12,,,33,10,18,25,127,174,1254 DK B,DK1254B_
18,"CONCORD WALLCOVERINGS ? Wallpaper Border Vintage Pattern Molding Style for Bedroom Living Room Kitchen, Beige Cream, 15 ft by 6 in 75591DL",B092L2WQJL,,,18.77,,,,24,,72,7,10,43,125,155,75591DL,75591DL_
19,"CONCORD WALLCOVERINGS ? Abstract Wallpaper Border Featuring Leaves and Flowers Design, Colors Gray Blue, Size 5.25 Inches by 15 Feet FT75803",B07RLTPS24,,,18.77,,,,,,23,2,7,11,119,162,FT75803,6V-M9RT-SWXE
20,"CONCORD WALLCOVERINGS ? Country Wallpaper Border American Flag Birdhouse Heart Angels for Dining Area Living Room Social Room, White Blue Red Brown, 15 Ft by 7 in AAI08121B",B09N4Y8D6W,24,,18.77,,,,12,,18,14,27,37,113,157,08121 AA B,AAI08121B_
21,"Prepasted Wallpaper Border - Purple Blue Flowers on Vine Scalloped Floral Wall Border Retro Design, Roll 15 ft. x 7 in.",B07L6TF49D,,,18.55,,24,,24,,37,6,24,40,113,224,MP73662N,MP73662N
22,"CONCORD WALLCOVERINGS ? Wallpaper Border Abstract Pattern Southwestern Ornament for Bedroom Living Room, Green Beige Red Blue, 15 ft by 6.75 in 7051007B",B09K8K48V7,,,18.77,,12,,,,40,1,6,15,112,171,7051007 B,7051007B_
23,"CONCORD WALLCOVERINGS ? Wallpaper Border Country Pattern Fruit Baskets Columns Birds Leaves, Die Cut Edge for Cottage Farmhouse Kitchen, Brown Green Red, 15 ft by 8.75 in KS76858DLL",B0BJFMCT9J,,,18.77,12,,12,12,,10,6,18,29,111,111,76858 KS DLL,KS76858DLL_XX
24,"CONCORD WALLCOVERINGS ? Wallpaper Border Vintage Country Pattern Farm Animals Cow Sheep Pig Dug Chicken Rooster Sunflowers for Cottage Dining Area, Multicolored, 10 Inches by 15 Feet KR2532B",B09FR4GXDG,,,18.22,12,,,,,8,4,7,10,105,232,2532 KR B,KR2532B._
25,"CONCORD WALLCOVERINGS ? Wallpaper Border Floral Pattern Flowers Leaves for Bedroom Living Room Kitchen, Purple Blue Green, 15 ft by 3 in PP76558",B07RV2MHKS,,,18.77,,,,,,43,6,11,24,104,304,PP76558,OW-T0O9-XOGF
26,"Concord Wallcoverings Wallpaper Border Vintage Vine Floral Pattern Flowers Leaves Butterfly Dragonfly for Kitchen Dining Area Cottage, Colors Beige Burgundy Brown Green, Size 7 Inch by 15 Ft 41776620",B08T4HLRSX,,,18.77,,,12,12,,19,3,25,34,103,190,41776620,41776620_
27,"CONCORD WALLCOVERINGS ? Wallpaper Border Country Pattern Cowboys Horses for Cottage Farmhouse Hunter's House, Beige Gray, 15 ft by 9 in NM6837B",B07QFSPZXY,,,18.77,12,,,12,,7,12,19,41,100,251,6837 NM B,Concord_WB_1347
28,"CONCORD WALLCOVERINGS ? Wallpaper Border Floral Pattern Roses Grape Leaves for Living Room Bedroom Cottage, Pink Burgundy Green Beige Brown, 15 ft by 9.75 in AU5114B",B09P1QLZ5Q,,,18.22,12,,,,,2,0,3,5,99,154,5114 AU B,AU5114B_
29,"Wallpaper Border - Blue Purple Rhombus Abstract Green Wall Border Retro Design, Prepasted Roll 15 ft. x 7 in.",B07L6VT4J4,,,18.93,,,,12,,36,8,17,22,97,302,EHD_BO_SUMMER1_NS71809W,NO-DIF8-MOVA
30,"Concord Wallcoverings Wallpaper Border Floral Pattern Flowers Bouquet for Living Room Bedroom Cottage, Red Pink Beige, 15 ft by 7 in WD76831",B07QBR77FN,,,18.22,12,,,,,1,5,9,9,93,228,76831 WD,WD76831_
31,"CONCORD WALLCOVERINGS ? Wallpaper Border Kids Pattern The Solar System Planets Stars for Kid's Bedroom Playroom, Black Blue Red Yellow Green Purple, 4.5 Inches by 15 Feet GU92122B",B07QFSNDJ9,,,18.77,,,,,,33,8,12,21,92,720,92122 GU B,Concord_WB_0743
32,"Beige Blue Black Abstract Wallpaper Border Rhombus Geometric Design, Roll 15' x 7''",B075QNY6ZC,,,18.99,,,,,,11,0,1,1,91,241,OA72860FM,OA72860FM
33,"Wall Border - Faux Distressed Abstract Green Vines Wallpaper Border Retro Design, Prepasted Roll 15 ft. x 7 in.",B07L6KSMYS,,,18.88,24,,,12,,6,13,19,34,90,269,EHD_BO_SUMMER1_ZN76161,GD-2I14-3KI9
34,"CONCORD WALLCOVERINGS Wallpaper Border Vintage Pattern Iron Baskets Clothespins for Laundry Room Powder Room Cottage Farmhouse, White Brown Gray, 15 ft by 6.2 in KH6092B",B0BKMLG4G5,12,,18.77,,,,,,8,6,8,10,90,91,6092 KH B,KH6092B_
35,"CONCORD WALLCOVERINGS ? Wallpaper Border Nautical Pattern Birds Beach Lighthouse Sails for Bathroom Cottage Powder Room, Blue Beige Brown, 15 Feet by 9 Inches CD70482N",B0BJMS2W4J,,,18.77,12,,12,12,,22,8,28,29,89,89,70482 CD N,CD70482N_
36,"Wall Border - Brown Moose Green Chrismas Tree Distressed Wallpaper Border Retro Design, Prepasted Roll 15 ft. x 7 in.",B07L6S8Z8H,,,18.11,24,12,,,,15,2,21,30,89,129,13227N,5W-LBWC-OQDD
37,"CONCORD WALLCOVERINGS ? Prepasted Floral Decorative Wallpaper Border Blue Roses and Leaves, Colors Beige Blue Green, Size 8 Inches by 15 Feet ED76259",B07QHX8BHB,,,18.77,24,,,,,5,3,17,22,88,276,76259 ED,Concord_WB_0229
38,"CONCORD WALLCOVERINGS ? Wallpaper Border Rooster Pattern Chickens Laundry Iron for Kitchen Dining Room Living Room, Red Green White Brown, 15 Feet by 9 Inches BSB7023B",B0BKH9JC2W,,,18.77,,,,12,,29,1,10,19,87,87,7023 BSB B,BSB7023B_
39,"CONCORD WALLCOVERINGS ? Classic Vine Wallpaper Border Featuring Multicolored Grapes, Colors Green Purple Orange Red, Size 10.25 Inches by 15 Feet EG022201B",B07RHVQB64,,,18.77,,,,,,33,14,16,19,87,109,EG022201B,3Z-TOHG-HOKK
40,"CONCORD WALLCOVERINGS ? Seashore Wallpaper Border Featuring Multiple Lighthouses on Shades of Blue, Colors Green Navy Blue Yellow, Size 6.75 Inches by 15 Feet KV79528",B07ZP9PD9T,,,18.77,12,,,,,22,12,19,26,87,199,KV79528,4X-TJ7N-QV52
41,"CONCORD WALLCOVERINGS ? Wallpaper Border Textured Vintage Pattern Leaves for Bedroom Living Room Dining Area, White Silver, 15 ft by 7 in 93385",B09JL6G8CL,,,18.77,24,,,,,1,2,33,37,86,89,93385,93385_
42,"Wall Border - Vintage Bathrooms in Squares Faux Distressed Wallpaper Border Retro Design, Prepasted Roll 15 ft. x 7 in.",B07L6KSMYQ,,,18.94,,,,12,,26,2,8,24,86,122,SP76478,SG-8MWK-56U0
43,"Iron Clothespins Basket Bottle Kitchen Bathroom Wallpaper Border Retro Design, Roll 15' x 6''",B0764J7ZZF,,,18.77,12,,,,,36,10,22,30,84,159,KH6092BD,01-R0CJ-O414
44,"Norwall Vintage Birdhouses Sunflowers Gardening Tools Picket Fence Coconut White Wallpaper Border Retro Design, Roll 15' x 7''",B0778M984M,,,18.22,12,,,,,8,7,7,7,83,212,NC76777,M2-N3J7-L6AF
45,Norwall Labrador Wallpaper Border,B0099PS5F4,24,,18.96,,,,,,8,20,22,31,80,124,AW77372LL,0T-FVSZ-IV06
46,"Patton GH74104B Leaf Trail Wallpaper Border, Green",B00EUJJYQS,,,18.99,,,,,,38,4,8,12,79,120,GH74104B,3M-5NM5-HRAW
47,Decorative Wallpaper Border Abstract Butterflies Pattern Wall D?cor Colors Pink Beige Brown Retro Classic Style Size 6.75 Inch by 15 Feet,B00CP4MYTE,12,,18.22,12,,,,,0,7,11,15,77,677,BH11-089-001-41,CC-RATE-1UBD
48,"CONCORD WALLCOVERINGS Wallpaper Border Nautical Pattern Seashells for Bathroom Beach House, Beige, 15 ft by 8 in VC819B",B08R6DS645,12,,18.77,,,,12,,18,8,11,24,75,191,819 VC B,VC819B_
49,"Row Boats in the River Shore Vintage Wallpaper Border Retro Design, Roll 15' x 7''",B003XWFQ1K,,,18.99,,,,,,36,3,8,24,74,213,CW32052B,CW32052B
50,Cats with Green and Blue Collars on Purple Bench ISB4102B Wallpaper Border,B07FZTL5C2,,,18.11,,,,,,42,4,9,16,74,172,ISB4102B-GP,YW-7T8J-E209
51,"CONCORD WALLCOVERINGS ? Prepasted Floral Style Wallpaper Border Featuring Watercolor Tulips Painting, Colors Pink Blue Green, Size 7 Inch by 15 Ft CT78172",B07QHZ16NK,12,,18.77,24,,,,,5,18,28,32,69,143,78172 CT,Concord_WB_0206
52,"CONCORD WALLCOVERINGS ? Wallpaper Border Floral Vine Pattern Molding Style Flowers Leaves for Bedroom Living Room, Pink Green Navy Beige Grey, 8.75 Inches by 15 Feet HB75712DC",B09JTSV58X,,,18.77,24,,,,,8,15,20,26,68,69,75712 HB DC,HB75712DC_
53,"CONCORD WALLCOVERINGS ? Wallpaper Border Vintage Pattern Floral Ornaments for Bathroom Bedroom Living Room, Green, 7 Inches by 15 Feet 5510611",B0B94K6NTV,,,18.77,24,6,,,,2,18,21,23,68,71,5510611,5510611_
54,"CONCORD WALLCOVERINGS ? Wallpaper Border Garden Vine Pattern Leaves Butterfly Bee Bug Dragonfly for Dining Area Cottage Farmhouse, Multicolored, Double Sided Die Cut Edge, 6 Inches by 15 Feet BH1853B",B09FFV7FCD,,,18.77,,,,,,8,1,1,5,66,126,BH1853B,BH1853B_
55,"York Wallcoverings DS7745BD Walt Disney Kids II Monsters Inc Border, Aqua/Blues/Purples/Greens/Black/White",B00MR0DO6I,,,18.77,,,,,,25,2,2,8,65,97,DS7745BD,84-VG1T-CG0J
56,7 in x 15 ft Prepasted Wallpaper Borders - Vintage Wall Paper Border ZN76163,B07KMVPLS5,,,18.22,12,,,,,5,2,2,3,65,279,ZN76163,JD-RQMX-F70S
57,"CONCORD WALLCOVERINGS ? Wallpaper Border Classic Pattern in Beige Matching Kitchen Bathroom Living Room, Size 10 Inches by 15 Feet UB104564",B07S9449B5,,,18.55,,,12,,,47,0,4,9,62,236,104564 UB,IP-8SCA-ZK8H
58,"CONCORD WALLCOVERINGS ? Wallpaper Border Kitchen Pattern Bottles Flowers on Wooden Shell for Kitchen Dining Area Cottage, Grey Blue Yellow Green Red Brown, 8 Inches by 15 Feet HM79353N",B09C2PPMRC,12,,18.77,,,,,,22,5,10,15,61,80,79353 HM N,HM79353N_
59,7 in x 15 ft Prepasted Wallpaper Borders - Bathroom Wall Paper Border SP76478,B07JH669PH,,,18.99,,,,,,32,2,6,14,61,226,SP76478,SP76478
60,Pink PF79505FP Floral Wallpaper Border,B004Q03S0O,,,18.45,,12,,,,30,0,11,18,61,176,PF79505,XC-U3YX-9HV1
61,"CONCORD WALLCOVERINGS ? Wallpaper Border Country Pattern Roosters Dishes Leaves, Die Cut Edge for Living Room Bedroom Dining Room, Beige Brown Green, 15 Feet by 8 Inches BSB7009B",B0BKH7XH4X,,,18.77,,,,,,21,0,3,6,58,58,7009 BSB B,BSB7009B_
62,"CONCORD WALLCOVERINGS ? Nautical Style Wallpaper Border Featuring Yacht and Boats in The Ocean, Colors Blue and White, Size 9.125 Inches by 15 Feet HU6130B",B07S41ZFQD,,,18.88,12,,,,,11,0,5,11,57,146,HU6130B,98-XHHU-4AFT
63,"CONCORD WALLCOVERINGS Wallpaper Border Floral Pattern Flowers Leaves, Die Cut Edge for Living Room Cottage Farmhouse Bedroom, Pink Blue Green, 15 ft by 9.5 in WV7460B",B0BHZSZC91,,,18.77,,,,12,,37,0,4,14,56,56,7460 WV B,WV7460B_
64,"CONCORD WALLCOVERINGS ? Wallpaper Border Country Retro Style Houses Sheep for Bedroom Kitchen Dining Area, Colors White Beige Dark Blue Red Brown, Size 7 Inches by 15 Feet AAI08141B",B092KLDLGX,12,,18.77,,,,,,12,2,7,10,55,117,8141 AAI B,AAI08141B_
65,"Jungle Savannah Lion Leopard Elephant Giraffe Zebra Beautiful Realistic Animal Wallpaper Border Modern Design, Roll 15' x 8''",B076BRWZK7,,,18.99,,,,,,36,5,8,10,55,144,5815165,TL-LGT8-SS0M
66,"Concord Wallcoverings Wallpaper Border Country Pattern River Fish Water Pants for Cottage, Blue Green Gray, 15 Feet by 9 Inches WPN1081",B07SB8K62J,,,18.77,,,,,,14,1,8,10,55,144,1081 WPN,WPN1081
67,"CONCORD WALLCOVERINGS Wallpaper Border Vintage Pattern Grapes Leaves for Cottage Kitchen Dining Room, Cream Blue Green, 15 Feet by 10 Inches KR2554B",B0BFZCT3FJ,12,,18.77,12,,,,,6,6,14,19,54,54,2554 KR B,KR2554B_
68,"CONCORD WALLCOVERINGS Wallpaper Border Kids Pattern Butterfly, White Pink Purple Teal Silver Grey, 7 Inches by 15 Feet GK8936B",B09F72F8S7,12,,18.77,,,,,,1,0,0,3,53,103,8936 GK B,GK8936B._
69,"CONCORD WALLCOVERINGS ? Wallpaper Border Green Leaves on Branches Floral Grey 9"" x 15' TK6346B",B07QCQWD8C,,,18.11,,,24,,,39,3,13,18,51,92,6346 TK B,Concord_WB_0937
70,"Clothes Pegs Clothespins on Vine Kitchen Bathroom Wallpaper Border Retro Design, Roll 15' x 4.5''",B003XWMBIG,,,18.98,,,,,,28,7,7,9,51,112,FAM65041B,FAM65041B
71,"CONCORD WALLCOVERINGS ? Wallpaper Border Quilted Stars, Buttons, and Berries 5"" X 15' Fam65011b",B07QFSKSQ5,12,,18.96,,,,,,4,6,6,6,50,169,65011 FAM B,Concord_WB_0236
72,"CONCORD WALLCOVERINGS ? Classic Prepasted Wallpaper Border Blue Pink and White Flowers, for Kitchen or Bedroom Walls, Size 6.5 Inch by 15 Ft KBE12562B",B07QHZKRXR,,,18.22,6,,,,,10,1,5,6,50,193,12562 KBE B,Concord_WB_0322
73,"CONCORD WALLCOVERINGS ? Wallpaper Border Fruits Pattern Apples Grape Leaves for Kitchen Cottage Farmhouse, Green Pink Red, 15 ft by 5 in KT77908DC",B07QHXZ12V,,,18.77,,,,,,21,6,19,25,50,118,77908 KT DC,Concord_WB_0368
74,"CONCORD WALLCOVERINGS ? Wallpaper Border Garden Pattern Flowers in Baskets Birds Houses for Cottage Farm House, Pastel Red Orange Blue Green Brown, 10 Inches by 15 Feet 5806781",B09TRY118C,,,18.77,,,,,,13,0,0,6,50,56,5806781,5806781_
75,"CONCORD WALLCOVERINGS ? Wallpaper Border Vine Floral Pattern Country Style Flowers Leaves for Kitchen Dining Area Cottage, Brown Blue Red Beige Yellow, 6.75 Inches by 15 Feet DS9440B",B09FRL1MNP,,,18.77,6,,6,,,11,5,14,15,49,56,9440 DS B,DS9440B_
76,"CONCORD WALLCOVERINGS ? Wallpaper Border Vintage Pattern Rattan Tropical Elements for Cottage Farmhouse Living Room, Brown Green, 15 Feet by 4.5 Inches CW32022B",B08QLDSTP3,,,18.77,,,,,,19,10,11,16,48,73,32022 CW B,CW32022B_
77,"CONCORD WALLCOVERINGS ? Wallpaper Border Country Pattern Chicken Cows Barns Sunflowers Village for Cottage Kitchen Dining Room, Brown Blue Red Yellow Green, 15 Feet by 7 Inches CS531B",B08173ZDZ1,,,18.77,,,,,,29,1,2,4,47,66,531 CS B,CS531B
78,"CONCORD WALLCOVERINGS ? Retro Sunflowers Wallpaper Border Featuring Big Flowers and Leaves on a White Background, Colors Green and Yellow, Size 5 1/4 Inches by 5 YD",B007NZMFDA,,,18.22,6,,,,,3,1,3,6,47,207,77922 KT DA,23-J0K0-WTKQ
79,"CONCORD WALLCOVERINGS ? Wallpaper Border Vintage Pattern Lotions Soap Parfum Flowers for Bathroom Powder Room Bedroom, Blue Gray Pink, 15 ft by 9.2 in KM7939B",B0BK9YWM1G,,,18.77,12,,24,,,0,0,4,16,47,47,7939 KM B,KM7939B_XX
80,"CONCORD WALLCOVERINGS ? Wallpaper Border Abstract Pattern Trellis Flowers for Bedroom Living Room, Beige White Creamy, 7 Inches by 15 Feet VO4455B",B09KCPS8DL,,,18.77,,,,,,30,0,0,0,47,53,4455 VO B,VO4455B__
81,"Concord Wallcoverings Prepasted Classic Floral Wallpaper Border Featuring White Blue and Pink Flowers, Size 5.25 Inches by 15 Feet CUP3391",B07RJTN9PL,,,18.77,,,,,,35,2,3,7,47,151,3391 CUP,XZ-6KCR-5ZUP
82,"Concord Wallcoverings Classic Floral Wallpaper Border Featuring Flowers Vine, Colors White Beige Pink Grey, Size 8 Inches by 15 Feet EP7183B",B07S185GQ3,,,18.77,,,,,,20,2,12,12,47,136,7183 EP B,49-I2M1-2JJG
83,9 in x 15 ft Prepasted Wallpaper Borders - Paris Wall Paper Border EU4600B,B0032G5VQW,,,18.99,,,12,,,29,6,6,11,46,133,4600 EU B,EU4600B
84,7 in x 15 ft Prepasted Wallpaper Borders - Roosters Wall Paper Border RG3843B,B07KMW5FF4,,,18.98,12,,,,,11,9,14,18,46,93,3843 RG B,RG3843B
85,"CONCORD WALLCOVERINGS ? Wallpaper Border Floral Pattern Sunflowers Chamomiles Apples Leaves for Dinning Area Kitchen, White Yellow Green Blue Red, 9 Inches by 15 Feet 5508332",B0B94MD2T2,,,18.77,12,,,12,,16,9,15,23,46,46,5508332,5508332_
86,"CONCORD WALLCOVERINGS Paintable Wallpaper Border Textured Vintage Architectural Geometric for Bedroom Living Room Basement , White, Size 5.25 in x 15 Ft A79806F",B09WJK8Q58,,,18.77,12,,,,,6,2,16,16,44,47,79806 A F,A79806F_1_
87,"Wall Border - Abstract Colors Garnet Red Beige Sage Green Wallpaper Border Retro Design, Prepasted Roll 15 ft. x 5 in.",B07L6VJT5R,,,18.99,,,,,,45,0,0,3,44,144,EHD_BO_SUMMER1_58320591B,58320591B
88,"Prepasted Wallpaper Border - Home Blessings in Hearts Cerulean Blue Wall Border Retro Design, Roll 15 ft. x 5 in.",B07L6TQ47H,,,18.22,6,,,,,0,1,1,1,43,121,BT77708DC,BT77708DC_
89,"CONCORD WALLCOVERINGS ? Wallpaper Border Kitchen Pattern Flowers Fruits for Kitchen Dining Room Cottage, Colors White Yellow Green Blue Brown Pink Red, Size 6.5 Inch by 15 Ft 5508680",B08TMYWR9V,,,18.22,12,,,,,1,0,7,7,43,172,5508680,5508680_
90,"CONCORD WALLCOVERINGS ? Wallpaper Border Abstract Pattern Seashells Swirls Leaves for Bathroom Powder Room Living Room Bedroom, Beige Gray, 15 ft by 7 in 58847380",B0BKMLLT9S,12,,18.77,,,,,,11,2,6,10,43,43,58847380,58847380_XX
91,"CONCORD WALLCOVERINGS ? Wallpaper Border Garden Pattern Plants Flowers Leaves Pots Pans for Living Room Cottage, Beige Green Pink White Purple Blue, 7.5 Inches by 15 Feet AAI08011B",B09N4SDB8K,6,,18.77,,,,,,4,3,3,3,42,67,8011 AAI B,AAI08011B_
92,"Baseball Basketball Tennis Soccer Ball Basket Glove Bat Sports Wallpaper Border Retro Design, Roll 15' x 9""",B07B4MGD9P,,,18.22,,,,,,13,1,1,1,42,151,KZ1252B,KZ1252B_
93,"CONCORD WALLCOVERINGS ? Wallpaper Border Floral Vintage Pattern Flowers Leaves for Living Room Bedroom Cottage, White Blue Green Light Yellow, 5.5 Inches by 15 Feet PP79451",B09FN8JY9B,,,18.77,,,,,,21,3,10,15,42,55,PP79451,PP79451_
94,"Deer Drinking Water from Forest River Vintage Wallpaper Border Retro Design, Roll 15' x 8""",B07B1NMRHT,12,,18.89,,,,,,7,5,5,7,42,114,ADV2083B,Q2-2L78-HXX3
95,"Concord Wallcovering Prepasted Wallpaper Border Classic Beige Pattern Featuring Olive Tree Branch Vine, Size 5.25 Inches by 15 Feet TK78264",B07RYXFN5R,,,18.77,,,,,,20,1,5,13,41,261,78264 TK,IB-DDTO-RO8H
96,"CONCORD WALLCOVERINGS Wallpaper Border Floral Pattern Flowers Leaves Swirls for Cottage Bedroom Living Room, Beige Pink Green, 15 ft by 7 in KM7774B",B0BJS6XB28,,,18.77,12,,,,,1,2,6,10,41,41,7774 KM B,KM7774B_
97,"CONCORD WALLCOVERINGS ? Vintage Marine Pictures Wallpaper Border Featuring Ships and Sail Boats on The Ocean, Colors Blue White Brown Beige, Size 8.87 Inches by 15 Feet FS73753",B07S2F3BC5,,,18.22,12,,,,,1,0,0,0,41,93,FS73753,6I-2PZN-DN65
98,"York Wallcoverings Growing Up Kids Butterfly/Scroll Removable Wallpaper Border White, Pink, Purple, Teal, Silver Grey",B01MG65OYW,,,18.22,18,,,,,4,0,2,5,40,80,GK8936B,GK8936B
99,Wallpaper Border - Palm Tree Wall Paper Border SP76492L,B07NNSPZWG,,,18.99,,,,12,,20,1,5,9,40,88,SP76492L,6V-PZ68-XKX8
100,"CONCORD WALLCOVERINGS ? Wallpaper Border Kitchen Pattern Vegetables Fruits Eggs Baskets on Tablecloth for Kitchen Dining Area, Brown Green Yellow Beige Red, 9 Inches by 15 Feet CP033131B",B09N9SZQL1,,,18.22,12,,,,,10,0,4,9,39,69,33131 CP B,CP033131B_
101,"CONCORD WALLCOVERINGS ? Wallpaper Border Floral Pattern Bloomed Roses Leaves for Bedroom Kitchen Cottage Farmhouse Trailer House, Colors Maroon Dark Red Green Gold, Size 8 Inches by 15 Feet FFM10172B",B092G38BG3,,,18.77,6,,,,,5,0,5,7,39,110,10172 FFM B,FFM10172B_
102,"CONCORD WALLCOVERINGS Wallpaper Border Floral Pattern Flowers Berries Grapes Leaves for Kitchen Dining Area Cottage Farmhouse, Green Burgundy Gold, 15 ft by 9 in HV6063B",B0BKNFGY36,,,18.77,12,,,,,2,3,11,12,39,44,6063 HV B,HV6063B_XX
103,"CONCORD WALLCOVERINGS ? Wallpaper Border Garden Vine Pattern Leaves on The Wall for Cottage Farmhouse Dining Area, Green Grey, 9 Inches by 15 Feet TK6346B",B09DDHVM28,,,18.77,,,,,,28,0,4,7,39,40,TK6346B,TK6346B_.
104,"Moose in the Forest Swamp Wide Wallpaper Border Retro Design, Roll 15' x 9''",B0778RQGSG,12,,18.77,,,,,,0,4,6,8,38,97,WL5608B,WL5608B_
105,"CONCORD WALLCOVERINGS ? Abstract Art Wallpaper Border Featuring Lines, Colors Beige Baby Blue Grey, Size 7 Inches by 15 Feet CT78185",B07RDM9QS8,,,18.77,,,,,,14,0,4,8,38,188,CT78185,7E-MFLQ-I28T
106,"Sunworthy 138219 Scroll Leaf in Shades of Teal and Plum Wallpaper Border, Pink",B014O6UD5W,,,18.98,,,12,,,24,0,5,7,37,57,138219,97-EEWF-2CI9
107,"CONCORD WALLCOVERINGS ? Vintage Garden Wallpaper Border Featuring Artificial Pond Flowers Pots Statues Fishes, Colors Green Blue Yellow White Orange, Size 10.5 Inches by 15 Feet WE672B",B07S863NF4,,,18.77,12,,,,,10,5,5,7,37,50,WE672B,BP-OTNR-WXU4
108,"CONCORD WALLCOVERINGS ? Decorative Kids Room Wallpaper Border Featuring Jungle Animals - Tiger Zebra Giraffe Cheetah, Colors Beige Brown Colors, Size 7 Inch by 15 Feet NA016121B",B07QHX2NLN,,,18.77,,,,12,,28,2,2,10,37,152,016121 NA B,Concord_WB_0843
109,"CONCORD WALLCOVERINGS Wallpaper Border Floral Pattern Flowers Leaves for Bedroom Living Room, Pink Purple Green Beige, 6.75 Inches by 15 Feet GU92103B",B09NYMC3ZB,,,18.22,12,,,,,3,0,0,0,37,76,92103 GU B,GU92103B_
110,"CONCORD WALLCOVERINGS ? Wallpaper Border Patriotic Pattern Vintage American Countryside for Dining Area Living Room Social Room, Navy Red White Blue Green Brown Yellow, 8 Inches by 15 Feet PC95042B",B09MSQT896,,,18.77,,,,,,32,2,2,18,37,57,95042 PC B,PC95042B_
111,"York Wallcoverings Brothers and Sisters V Barnyard Friends Border, Beige, White, Black, Pink, Brown",B01CKJJIZ6,,,18.99,,,,,,18,0,0,1,37,63,3459697,SB7679BD_
112,"CONCORD WALLCOVERINGS ? Vintage Porcelain Tableware Wallpaper Border Featuring Teapots Flowers and Plates, Colors Green White and Pink, Size 10 Inches by 15 Feet HH90224B",B07S2WQYX6,,,18.77,,,,12,,22,0,3,9,36,105,HH90224B,20-7CFI-P91B
113,"CONCORD WALLCOVERINGS ? Wallpaper Border Vintage Victorian Style for Living Room Bedroom Home Office, Colors Burgundy Camel Gold Dark Brown, Size 7 Inches by 15 Feet EP7151B",B097TVGV8T,,,18.77,12,12,,6,,0,9,15,20,36,51,7151 EP B,EP7151B_
114,"CONCORD WALLCOVERINGS ? Wallpaper Border Kitchen Pattern Fruits Leaves for Dining Area Cottage, Cream Red Green Brown Purple Pink, 7.5 Inches by 15 Feet LA15015DB",B09BXVH92Z,,,18.77,12,,,,,6,7,12,12,36,47,15015 LA DB,LA15015DB_
115,"CONCORD WALLCOVERINGS ? Wallpaper Border Geographic Pattern Antique World Map for Living Room Cottage, Gold Brown Blue Red Green, 20.75 Inches by 15 Feet OS1218B",B09JHN3G4X,,,18.77,,,,,,16,4,4,4,36,56,1218 OS B,OS1218B_
116,Pine Cones Acorns Purple WL5576B Wallpaper Border,B07FZRBJWY,,,18.22,12,,,,,0,6,6,6,36,86,5576 WL B,WL5576B
117,"CONCORD WALLCOVERINGS ? Elegant Olive Leaves Wallpaper Border Featuring Geometrical Figures and Plants, Colors Green Gold, Size 7 Inches by 15 Feet EP7280B",B07RLS48SM,,,18.77,,,,,,19,2,2,11,35,61,EP7280B,BX-8240-J7QK
118,"CONCORD WALLCOVERINGS ? Prepasted Wallpaper Border Running Faded Floral Pattern, Classic Retro Style, Color Beige, Size 6 Inches by 15 Feet 31616360",B07QFSNVRP,,,18.77,,,,6,,15,7,7,11,35,73,31616360,Concord_WB_0509
119,"CONCORD WALLCOVERINGS ? Wallpaper Border Floral Pattern Small Flowers and Leaves for Bedrrom Dining Area, Purple Green Pink Gold, 6.75 Inches by 15 Feet Des87957DC",B09DMK6PG7,,,18.22,12,,,,,1,5,5,5,35,65,87957 DES DC,Des87957DC_
120,"CONCORD WALLCOVERINGS ? Wallpaper Border Floral Pattern Sunflowers Leaves, Die Cut Edge for Kitchen Dining Area Cottage, Red Green Yellow, 5.25 Inches by 15 Feet KT77920DC",B0B94R5XSH,,,18.77,,,,,,18,4,7,7,35,39,77920 KT DC,KT77920DC_
121,"CONCORD WALLCOVERINGS Wallpaper Border Garden Pattern Fruits Herbs Baskets for Kitchen Dining Room Cottage, Brown Green Red Yellow, 15 Feet by 11 Inches KR2325",B0BFFZFTV3,,,18.77,,,,,,15,0,1,6,34,34,2325 KR,KR2325_
122,"CONCORD WALLCOVERINGS ? Wallpaper Border Vintage Pattern Cats Ironing Morning Routine for Bathroom Laundry Room, Beige Brown Gray Red Blue, 15 Feet by 7 Inches KBE12603B",B07QFSNVX5,,,18.77,,,,,,15,5,6,8,33,36,12603 KBE B,Concord_WB_0798
