id,Title,ASIN,SHP,N_Price,Price,1_W,2_W,3_W,4_W,Inbound,Inv,30,60,90,12m,2000-2025,Parts__Num,SKU
958,"Concord Wallcoverings Wallpaper Border Sports Pattern Soccer Balls Words for Boy's Bedroom Playroom, Yellow Green Pink Purple, 15 Feet by 9 Inches JE3736B",B07QFSM8VP,,,18.22,,,,,,3,1,1,3,3,7,3736 JE B,Concord_WB_0791
959,"Concord Wallcoverings Wallpaper Border Vintage Pattern Seashells Words for Bathroom Cottage, Beige, 15 Feet by 7 Inches KT003161B",B07QBR84PJ,,,18.22,,,,,,0,0,0,0,3,9,003161 KT B,Concord_WB_0820
960,"CONCORD WALLCOVERINGS ? Wallpaper Border Nautical Pattern Sea Sailboats Sky Clouds for Cottage Beach House Bedroom, Blue Green Red Yellow, 15 ft by 10 in CC829B",B07QFSPDDY,,,18.22,,,,,,3,2,2,2,3,5,829 CC B,Concord_WB_1077
961,"CONCORD WALLCOVERINGS Wallpaper Border Country Pattern Ornamented Jugs Corn Cayenne Peppers for Living Room Cottage Farmhouse Kitchen, Beige Brown Black, 15 ft by 9 in DB3761B",B0BJ7NHNRW,,,18.77,,,,,,8,0,0,0,3,3,3761 DB B,DB3761B_
962,"CONCORD WALLCOVERINGS ? Wallpaper Border Country Pattern Village Ducks Geese for Cottage Living Room, Brown Green Blue Yellow, 9 Inches by 15 Feet ZK60241B",B07S86BCG5,,,18.77,,,,,,9,0,0,0,3,10,ZK60241B,DD-9O5H-MJUW
963,"CONCORD WALLCOVERINGS Wallpaper Border Kids Pattern Sharks for Kid's Bedroom Playroom, Blue Gray Brown, 15 ft by 10 in DS7692BD",B0BJFMZ4LF,,,18.77,,,,,,9,0,0,0,3,3,7692 DS BD,DS7692BD_
964,"CONCORD WALLCOVERINGS Wallpaper Border Kids Pattern Flowers for Girl's Bedroom Playroom, Pink Blue Yellow Green, 15 Feet by 6 Inches DW2371",B0BFFXHB3Q,,,18.77,,,,,,15,0,0,0,3,3,2371 DW,DW2371_
965,"CONCORD WALLCOVERINGS Wallpaper Border Place Pattern Restaurant Building Leaves Trees for Cottage Kitchen Dining Room, Yellow Green Brown Red, 15 Feet by 10 Inches EG022172B",B0BHX3X3TH,,,18.77,,,,,,3,0,3,3,3,3,022172 EG B,EG022172B_
966,"Pre-Pasted Decorative Wallpaper Border Faith & Family Design God Bless, Colors Burgundy Beige, Size 4.25 Inch by 15 Ft FF03284B",B002LE4Y1O,,,18.22,,,,,,6,0,0,0,3,7,FF03284B,FF03284B_
967,"CONCORD WALLCOVERINGS Wallpaper Border Floral Pattern Flowers Leaves Lines for Cottage Bedroom Living Room, Cream Blue Green, 15 ft by 5.5 in FK78460",B0BJS78DPR,,,18.77,,,,,,9,0,0,0,3,3,78460 FK,FK78460_
968,"Prepasted Wallpaper Border - Bear Fish Moose Duck Over Map Green Beige Wall Border Retro Design, Roll 15 ft. x 9 in.",B07L6TK88K,,,18.22,,,,,,4,0,1,1,3,27,4955 FS B,FS4955B
969,"CONCORD WALLCOVERINGS ? Wallpaper Border Animals Pattern Fish Duck Bear Deer on Map for Cottage, Beige Blue White Brown Black, 9.25 Inches by 15 Feet FS4956B",B09L8L44JG,,,18.77,,,,,,0,0,2,2,3,22,4956 FS B,FS4956B_
970,"CONCORD WALLCOVERINGS ? Wallpaper Border Country Pattern Roosters Houses for Dining Area Kitchen Cottage, Red Yellow Green Blue, 15 ft by 8 in GG54141B",B09P4FCSMJ,,,18.22,,,,,,3,0,0,0,3,3,54141 GG,GG54141B_1__X
971,"CONCORD WALLCOVERINGS Wallpaper Border Nature Pattern Forest on The River Ducks Blue Sky for Cottage Farmhouse Living Room Dining Area, Green Blue Gray, 15 ft by 7 in GL76354N",B0BHZSGZW6,,,18.77,,,,,,4,0,0,0,3,3,76354 GL N,GL76354N_
972,"CONCORD WALLCOVERINGS ? Wallpaper Borders Dinosaurs Pattern Island Volcano Palms Reptilians for Boys Bedroom, Green Orange Blue Purple Yellow, 7 Inches by 15 Feet GU92041B",B09NYQKGML,,,18.77,,,,,,10,0,0,3,3,11,92041 GU B,GU92041B_
973,"CONCORD WALLCOVERINGS Wallpaper Border Kid's Pattern Bugs Butterflies Flowers for Kid's Bedroom Playroom, Blue Pink Green Yellow, 15 ft by 4.5 in GU92131B",B0BKTGKQTN,,,18.77,,,,,,14,0,0,0,3,3,92131 GU B,GU92131B_
974,Oriental Palm Trees Wallpaper Border,B001DDH330,,,18.22,,,4,,,4,0,0,0,3,24,SP76491,HC-X3VZ-68PW
975,Green Cream Mold Tree Leaves Wallpaper Border,B008OPHYTS,,,18.22,,,,,,0,0,0,0,3,8,SF78317N,HE-PV3W-92P0
976,"CONCORD WALLCOVERINGS Wallpaper Border Country Pattern Town River Ships for Cottage Farmhouse Living Room, Beige Blue Green, 15 ft by 9 in HF8524B",B0BK2VP4R2,,,18.77,,,,,,6,0,0,0,3,3,8524 HF B,HF8524B_XX
977,"CONCORD WALLCOVERINGS Classic Kitchen Wallpaper Border Featuring Leaves and Grapes, Colors Green Purple Beige Size 7 Inches by 15 Feet TK6412B",B07RWKVNT8,,,18.77,,,,,,9,2,2,2,3,66,6412 TK B,HL-ZEPD-GW3O
978,"CONCORD WALLCOVERINGS ? Wallpaper Border Floral Pattern Flowers for Living Room Bedroom Kitchen, Beige Cream Pink Green, 15 ft by 5 in HT73977",B09KP25HCD,4,,18.77,,,,,,3,3,3,3,3,3,73977 HT,HT73977_XX
979,"CONCORD WALLCOVERINGS ? Wallpaper Border Art Pattern Abstract Lines for Cottage Bedroom Living Room, Purple Gray, 15 ft by 5.25 in ?HT73987",B0BKTXYFC1,,,18.77,,,,,,6,0,0,0,3,3,73987 ?HT,HT73987_YY
980,"CONCORD WALLCOVERINGS Wallpaper Border Tropical Pattern Palm Tree Leaves Coconuts for Kitchen Dining Area Beach House Farmhouse, Green Beige Brown, 15 ft by 9.2 in HV6011B",B0BKMX52M8,,,18.77,,,,,,6,0,0,0,3,3,6011 HV B,HV6011B_XX
981,"CONCORD WALLCOVERINGS ? Wallpaper Border Kids Pattern, Toys Bears Sport Accessories for Baby Boy Nursery Room Daycare Playroom, 9.25 Inch by 15 Ft ID5350B",B08PW681BS,,,18.22,,,,,,1,0,0,0,3,6,5350 ID B,ID5350B_
982,"CONCORD WALLCOVERINGS ? Wallpaper Border Kids Pattern Story Illustrations for Kids Bedroom Play Room, White Yellow Green, 9.5 Inches by 15 Feet ID5466B",B09GWD7N2D,,,18.22,,,,,,0,0,0,0,3,3,5466 ID,ID5466B_XX
983,"CONCORD WALLCOVERINGS Wallpaper Border Floral Pattern Roses Flowers Leaves for Bedroom Living Room Cottage, Pink Green Cream, 15 Feet by 8.25 Inches IG75174B",B07RGXJ8M5,,,18.22,,,,,,0,0,0,0,3,3,75174 IG B,IG75174B
984,"CONCORD WALLCOVERINGS Wallpaper Border Kids Pattern Cartoon Dog in Pictures for Kid's Room Playroom Bedroom, Blue Red Brown, 15 ft by 6.8 in JC5970B",B0BKNHR7N2,,,18.77,,,,,,9,0,0,0,3,3,5970 JC B,JC5970B_XX
985,"CONCORD WALLCOVERINGS Wallpaper Border Floral Pattern Flowers Lilies Leaves Butterflies, Die Cut Edge for Living Room Dining Area Cottage, Green Lilac Yellow, 15 ft by 10.3 in JT7506B",B0BHZRPXX4,,,18.77,,,,,,10,0,0,0,3,3,7506 JT B,JT7506B_
986,"CONCORD WALLCOVERINGS ? Wallpaper Border Vintage Pattern Coffee Shops Labels for Kitchen Cottage Farmhouse Dining Area, Beige Red Brown, 15 Feet by 7 Inches 330809",B0BHFBCK79,,,18.77,,,,,,9,0,0,0,3,3,330809,330809_XX
987,"CONCORD WALLCOVERINGS Wallpaper Border Country Pattern Fish Salmon Lines for Cottage, Green Beige Burgundy, 8 Inches by 15 Feet HU6252B",B07S1XWQZQ,,,18.77,,,,,,13,0,0,0,3,5,6252 HU B,36-1W3X-XHWD
988,"CONCORD WALLCOVERINGS ? Classic Floral Wallpaper Border Featuring Yellow Roses on Green and Beige Background, Size 10.25 Inches by 15 Feet FR4998B",B07RLWK2ZS,,,18.77,,,,,,10,0,0,0,3,39,4998 FR B,OY-A94W-5XIY
989,"CONCORD WALLCOVERINGS ? Wallpaper Border Country Pattern Carpets House Goose Laundry for Laundry Room Cottage Bathroom, Green Brown Purple Blue, 15 Feet by 8.5 Inches PC95012B",B0BKH957L5,,,18.77,,,,,,9,0,0,0,3,3,95012 PC B,PC95012B_X_
990,"CONCORD WALLCOVERINGS ? Wallpaper Border Floral Pattern Flowers Leaves for Living Room Kitchen Bedroom, Green White Brown, 15 ft by 7 in PG027161B",B09QRPL2VS,,,18.22,,,,,,0,0,0,0,3,3,27161 PG B,PG027161B_
991,"CONCORD WALLCOVERINGS ? Wallpaper Border Floral Pattern Flowers in Pots for Farmhouse Cottage, Green Red Purple Cream, 15 ft by 7 in PKB1238",B09HJFB9J5,,,18.77,,,,,,6,0,0,0,3,3,1238 PKB,PKB1238_
992,"CONCORD WALLCOVERINGS Wallpaper Border Floral Pattern Roses Leaves Ellipses for Living Room Bedroom Bathroom Powder Room, Green Pink, 15 ft by 3.9 in PP79059",B0BKBJT4FN,,,18.77,,,,,,9,0,0,0,3,3,79059 PP,PP79059_
993,"CONCORD WALLCOVERINGS ? Wallpaper Border Floral Pattern Flowers Leaves Buds for Living Room Bedroom Dining Area, White Pastel Pink Brown Green Purple, 3.75 Inches by 15 Feet PR79654",B0B33BR9Y9,,,18.77,,,,,,1,0,0,0,3,11,79654 PR,PR79654_
994,"CONCORD WALLCOVERINGS Wallpaper Border Fruit Pattern Strawberries Pears Plate for Cottage Kitchen Dining Room, Beige Red Green, 15 ft by 9 in RG3784B",B0BJRPB13F,,,18.77,,,,,,4,0,0,1,3,3,3784 RG B,RG3784B_XX
995,"CONCORD WALLCOVERINGS Wallpaper Border Vintage Pattern Flowers in Pots for Cottage Kitchen Dining Room, Black Brown Red Blue, 15 ft by 9 in RG3875B",B0BJSC1R8J,,,18.77,,,,,,9,0,0,0,3,3,3875 RG B,RG3875B_XX
996,"Wallpaper Border Gray Beige Classic 15' x 7"" NB76947 /O",B07S5RV9F3,,,18.22,,,,,,12,0,0,3,3,28,76947 NB,3S-8R1I-CT66
997,"CONCORD WALLCOVERINGS Wallpaper Border Floral Pattern Flowers Swirls Ornament, Die Cut Edge for Bedroom Bathroom Powder Room Living Room, Blue Silver White, 15 ft by 7 in SA75758B",B0BHZV3RRW,,,18.77,,,,6,,9,0,0,3,3,3,75758 SA B,SA75758B_XX
998,"CONCORD WALLCOVERINGS ? Vintage Fruits Wallpaper Border Featuring Apples Grapes Pears Peaches Leaves, Colors Beige Burgundy Brown, Size 7 Inches by 15 Feet DX1631B",B07RV5GC51,,,18.22,,,,,,0,0,0,0,3,14,SC028153B,SC028153B
999,"CONCORD WALLCOVERINGS ? Wallpaper Border Nature Pattern Birds Nests for Farmhouse Cottage Kitchen, Brown Green Light Blue, 15 ft by 10 in SG3902B",B09HKZWZZW,,,18.22,,,,,,0,0,0,0,3,3,3902 SG,SG3902B_
1000,"CONCORD WALLCOVERINGS ? Wallpaper Border Abstract Pattern Leaves for Living Room Bedroom Dining Area, Cream Beige Green, 15 ft by 5 in 403422",B09QF1R7H7,,,18.22,,,,,,0,0,0,0,3,3,403422,403422_
1001,"CONCORD WALLCOVERINGS Wallpaper Border Damask Pattern Floral Ornaments for Bedroom Living Room Bathroom Powder Room, Beige Brown, 15 ft by 7 in SS75480",B0BHZVYD55,,,18.77,,,,,,5,0,0,0,3,3,75480 SS,SS75480_XX
1002,"Beautiful White Cups Hanging on Kitchen Hooks Brown Wallpaper Border Retro Design, Roll 15' x 5.2''",B0764J6SQ1,,,18.22,,,,,,3,0,3,3,3,13,VCB1011,T9-DHYL-7IBP
1003,"CONCORD WALLCOVERINGS ? Wallpaper Border Vintage Pattern Seashells Flowers for Bathroom Powder Room Cottage, Cream Blue Green Pink Yellow, 15 ft by 5 in TD3241B",B07S957GZB,,,18.22,,,,,,4,0,0,0,3,5,3241 TD B,TD3241B_
1004,"CONCORD WALLCOVERINGS Wallpaper Border Vintage Pattern Big City Jazz Band for Cottage Living Room Dining Room, Black Brown Burgundy, 15 Feet by 10.25 Inches TG2232",B0BFFWXBZ4,,,18.77,,,,,,8,0,0,0,3,3,2232 TG,TG2232_
1005,"Retro Rooster Paintings on Green Wall Vintage Wallpaper Border, Roll 15' x 8''",B076BRQJP6,,,18.98,,,,,,0,0,0,0,3,28,5506053,TQ-W40G-F3FW
1006,"Sun, Moon and Stars Wallpaper Border BW77430",B011W234PC,,,18.77,,,,,,3,0,0,0,3,18,BW77430,UW-RK8A-FMBV
1007,"CONCORD WALLCOVERINGS ? Wallpaper Border Kids Pattern Handprints Footprints Lines Dots for Kid's Bedroom, Blue Green Yellow Red, 5 Inches by 15 Feet 41636940",B0BCXJ3TNV,,,18.77,,,,,,0,0,0,0,3,3,41636940,41636940_
1008,"CONCORD WALLCOVERINGS ? Abstract Wallpaper Border Stripes Design for Powder Room and Bedroom, Blue Brown Beige Green, Size 7 in x 15 Ft 41706060",B09QDM15NY,,,19.99,,,,,,1,0,0,0,3,9,41706060,41706060_1_
1009,"CONCORD WALLCOVERINGS Wallpaper Border Vintage Pattern Flowers Leaves for Cottage Bedroom Living Room, Light Purple Green, 15 ft by 10.25 in VT4636B",B0BJSNKLCB,,,18.77,,,,,,9,0,0,0,3,3,4636 VT B,VT4636B_X_
1010,"CONCORD WALLCOVERINGS ? Wallpaper Border Nautical Pattern Vintage Map Sailboats Frigate for Living Room Farmhouse Cottage Bathroom, Gray, 15 ft by 7 in WD76839",B0BJFMX6MG,,,18.77,,,,,,3,0,0,3,3,3,76839 WD,WD76839_
1011,"CONCORD WALLCOVERINGS Wallpaper Border Kids Pattern Butterflies Ornaments for Girls Room Powder Room, Purple Gold White, 15 Feet by 7 Inches WK6846B",B0BKH9RBGG,,,18.55,,,,,,9,0,0,0,3,3,6846 WK B,WK6846B_X_
1012,"CONCORD WALLCOVERINGS ? Wallpaper Border Vintage Pattern Flowers Circus Monkeys Ribbons for Play Room Bedroom, Cream Blue Pink Brown, 15 ft by 9 in WK6883BD",B08Y2N67GP,,,18.22,,,,,,0,0,0,0,3,18,6883 WK BD,WK6883BD_
1013,"Concord WALLCOVERINGS ? Wallpaper Border Bugs Pattern Flowers Frames Butterflies for Kid's Room Daycare Girl's Room, Blue Yellow Purple Beige, 15 Feet by 9 Inches WK9101B",B0BKHD52Q4,,,18.77,,,,,,9,0,0,0,3,3,9101 WK B,WK9101B_X
1014,"CONCORD WALLCOVERINGS Wallpaper Border Vintage Pattern Soap Candles Pine Cones for Bathroom, Beige Blue Green, 15 ft by 7 in WL5596B",B0BK2TB97S,,,18.77,,,,,,0,0,0,1,3,3,5596 WL B,WL5596B_XX
1015,"CONCORD WALLCOVERINGS Wallpaper Border Country Pattern Fir Branches Cones for Cottage Farmhouse Living Room, Cream, 15 ft by 7 in WL5664B",B0BK2RFN45,,,18.77,,,,,,3,0,3,3,3,3,5664 WL B,WL5664B_XX
1016,"CONCORD WALLCOVERINGS ?. Textured Wallpaper Border Classic Featuring Floral Motives, Green White, 5.1 in x 15 Ft, 294128",B0BQ3WHD33,,,18.77,,,,,,3,0,3,3,3,3,294128,WP_JETTE_2_294128_
1017,"CONCORD WALLCOVERINGS ? Wallpaper Border Vintage Pattern Fruits Leaves Floral Ornaments for Bedroom Living Room, Beige, 15 Feet by 10.25 Inches PZ1173B",B07S38J8FW,,,18.22,,,,,,1,0,0,0,3,3,1173 PZ B,WS-8CPR-WLFD
1018,"CONCORD WALLCOVERINGS ? Wallpaper Border Vintage Pattern Faux Pirate Signs Ships Piastres for Playroom Kid's Bedroom Cottage, Gray Red Brown, 15 Feet by 9 Inches ZB3113BD",B0BHFC2QNP,,,18.77,4,,,,,3,0,3,3,3,3,3113 ZB BD,ZB3113BD_XX
1019,"Texas Baseball Team Rangers Fan Sports Wallpaper Border MLB Retro Design, Roll 15' x 6""",B07B1Q2D25,,,18.22,,,,,,0,0,0,0,3,3,ZB3373BD,ZB3373BD_
1020,Blue Brown Birdhouses Wallpaper Border 30372131,B00IN1VTVW,,,18.98,,,,,,15,0,0,0,3,32,30372131,4U-J0DX-7K6N
1021,"God Bless America Stars American Flag Apples Hearts Vintage Wallpaper Border Retro Design, Roll 15' x 4.5''",B0779HSHDZ,,,18.22,,,,,,0,0,0,0,3,3,5806901,53-ZS34-I6TX
1022,"CONCORD WALLCOVERINGS Wallpaper Border Fruit Pattern Apples Leaves, Die Cut Edge for Cottage Kitchen Dining Room, Beige Green Burgundy, 15 ft by 7 in 577103",B0BK2RMG1Z,,,18.77,4,,,,,3,0,1,2,3,3,577103,577103_XX
1023,"CONCORD WALLCOVERINGS Wallpaper Border Art Pattern Birds Chicken Sunset for Cottage Kitchen Dining Room, Black Green Red Orange Beige, 7 Inches by 15 Feet PV5167B",B07S5G2HXC,,,18.77,,,,,,0,0,0,0,3,3,5167 PV B,67-GLDI-6H3Y
1024,"CONCORD WALLCOVERINGS Wallpaper Border Vintage Pattern Flowers in Vases Fruits Apples for Cottage Kitchen Dining Room, Beige Blue Green Red, 15 ft by 7 in 73165",B0BKTGYKFS,,,18.77,4,,,,,3,3,3,3,3,3,73165,73165_
1025,"CONCORD WALLCOVERINGS ? Wallpaper Border Floral Pattern Harvest Bouquets Lavender Sunflowers and Poppies with Red Trim for Cottage Farmhouse, Red Beige Yellow Green, 15 Feet by 6.9 Inches AAI08001B",B0BHF93Y8C,,,18.77,,,,,,12,0,0,0,2,2,08001 AAI B,AAI08001B_XX
1026,"CONCORD WALLCOVERINGS ? Kids Wallpaper Border Girls Power Retro Art for Play Room Bedroom, Pink Blue Yellow Green, 15 ft by 6 in 110045",B09JXSSK2B,,,18.22,,,,,,6,0,0,0,2,2,110045,110045_
1027,"CONCORD WALLCOVERINGS Wallpaper Border Damask Pattern Symmetrical Floral Ornaments for Cottage Bedroom Living Room, Brown Beige Green, 15 ft by 3.5 in AG7255B",B0BKTJ4XBG,,,18.77,,,,,,10,0,0,0,2,2,7255 AG B,AG7255B_
1028,"CONCORD WALLCOVERINGS ? Garden Wallpaper Border Vintage Pattern Village Houses for Cottage Kitchen Dining Area, Green Red White Blue, 15 ft by 7 in 110225",B09QDWVJ1J,,,18.77,,,,,,3,0,0,0,2,2,110225,110225_1_
1029,"CONCORD WALLCOVERINGS ? Wallpaper Border Floral Pattern Flowers Iris Peonies Leaves Vintage for Living Room Dining Area Cottage, Beige Blue Pink Red, 10 Inches by 15 Feet AJ102462",B0B94N9RFH,,,18.77,,,,,,7,0,0,0,2,2,102462 AJ,AJ102462_
1030,"CONCORD WALLCOVERINGS ? Wallpaper Border Kitchen Pattern Plants Flowers Pots Birdhouse Bee Nest for Cottage Farmhouse, Beige Blue Brown Yellow White Green, 7 Inches by 15 Feet ALB3762",B09MJH5TPW,,,18.77,,,,,,1,0,0,0,2,10,3762 ALB,ALB3762_
1031,"CONCORD WALLCOVERINGS Wallpaper Border Vintage Pattern Roosters in Frames for Kitchen Cottage Farmhouse, Navy Blue Beige, 15 ft by 10 in AU5264B",B0BK9YYP3F,,,18.77,,,,,,4,1,1,1,2,2,5264 AU B,AU5264B_
1032,"CONCORD WALLCOVERINGS ? Royal Drapes Wallpaper Border Featuring Curtains on a Dark Background, Colors Golden White, Size 9 Inches by 15 Feet EP7204B",B07S2C3HVD,,,18.22,,,,,,2,0,1,1,2,4,EP7204B,AX-NA31-FOEA
1033,"CONCORD WALLCOVERINGS ? Wallpaper Border Country Pattern Flowers Tableware Apples Grapes Eggs for Cottage Kitchen Dining Room, Green Red Brown Pink, 10 Inches by 15 Feet BB101904",B0BDGHWRQ2,,,18.77,,,,,,0,0,0,0,2,2,101904 BB,BB101904_
1034,"CONCORD WALLCOVERINGS ? Kids Wallpaper Border Children Tree Houses Dog for Play Room Bedroom, Green Blue White Yellow, 15 ft by 6 in BB4013A",B09JGQ8LB8,,,18.22,,,,,,0,0,0,0,2,4,4013 BB A,BB4013A_
1035,"CONCORD WALLCOVERINGS Wallpaper Border Fruits Pattern Grapes Apples Pears Plums Leaves, Die Cut Edge for Cottage Farmhouse Kitchen, Red Green Purple, 15 ft by 6.75 in BB75974DC",B0BHZVF2P4,,,18.77,,,,,,4,0,1,1,2,2,75974 BB DC,BB75974DC_
1036,"CONCORD WALLCOVERINGS ? Wallpaper Border Floral Pattern Colorful Leaves, Die Cut Edge for Kitchen Dining Area Cottage Living Room, Green Yellow Lilac, 15 Feet by 7 Inches 138902",B0BHFFLTG7,,,18.77,,,,,,4,0,0,0,2,2,138902,138902_XX
1037,"CONCORD WALLCOVERINGS Decorative Wallpaper Border Fruit Pattern Cherry Apples, One Side Laser Cut for Kitchen Dining Area, Green White Pink, 5 Inch by 15 Feet 147908",B08NWBBPK4,,,18.66,,,,,,18,0,0,2,2,12,147908,147908_
1038,"CONCORD WALLCOVERINGS ? Wallpaper Border Kids Pattern Dinosaurs Palms Mountains Lakes for Boy's Bedroom Playroom, Green Orange Blue, 15 ft by 12 in BE11371MB-12",B0BNNVWPGC,,,18.77,,,,,,5,0,0,0,2,2,11371 BE MB-12,BE11371MB-12_
1039,"American Kitchen Crops Floral Design Wallpaper Border Flowers for Kitchen Bathroom Living Room, Roll 15' x 9''",B074F13VD6,,,18.22,,,,,,0,0,0,0,2,78,BV006132B,BG-818P-K7QD
1040,"CONCORD WALLCOVERINGS Classic Floral Wallpaper Border - Green Yellow and Orange Flowers, Prepasted, Size 5.25 Inches by 15 Feet KT77921DC",B07RRQWHG4,,,18.22,,,,,,1,0,0,0,2,2,77921 KT DC,BN-IVNW-YCTX
1041,"Elephant Lion Giraffe Zebra Panda Tiger in Forest Wallpaper Border Realistic Design, Roll 15' x 10.25''",B076BVSQY3,,,18.22,,,,,,4,0,0,0,2,14,BR4461B,BR4461B
1042,"CONCORD WALLCOVERINGS ? Wallpaper Border Vintage Pattern Vine Leaves, Die Cut Edge for Living Room Dining Area Kitchen Cottage, Burgundy Green Brown, 15 Feet by 4.5 Inches 164901",B0BHFFFGJZ,,,18.77,,,,,,9,0,0,0,2,2,?164901,164901_
1043,"CONCORD WALLCOVERINGS Wallpaper Border Vintage Pattern Bird Houses Leaves, Die Cut Edge for Cottage Farmhouse Living Room, Brown Green, 15 ft by 8.5 in BSB7143B",B0BKV5C65C,,,18.77,,,,,,4,0,0,0,2,2,7143 BSB B,BSB7143B_
1044,"CONCORD WALLCOVERINGS ? Wallpaper Border Patriotic Pattern American Heart Angel Star for Cottage Kitchen Farmhouse Kid's Room, Yellow Green Brown Red Blue, 15 Feet by 6.8 Inches BV006184B",B0BG6FK1GP,,,18.77,,,,,,4,0,2,2,2,2,006184 BV B,BV006184B_
1045,"CONCORD WALLCOVERINGS ? Wallpaper Border Nature Pattern Hot Air Balloons Sea Mountains for Living Room Cottage Play Room, Blue Red White Green, 15 ft by 10 in CC836B",B09R6K1HRQ,,,18.22,,,,,,2,0,0,0,2,2,836 CC B,CC836B__
1046,"CONCORD WALLCOVERINGS Wallpaper Border Garden Pattern Fence Bird Houses Plants for Cottage Farmhouse Living Room, Beige White Green, 15 ft by 10 in CL5283B",B08QKN87K3,,,18.77,,,,,,0,0,0,0,2,42,5283 CL B,CL5283B_
1047,"CONCORD WALLCOVERINGS Wallpaper Border Fruit Pattern Apples Grapes Leaves, Die Cut Edge for Cottage Kitchen Dining Room, Beige Blue Green Red, 15 ft by 6 in CL72764DC",B0BKTG36V7,,,18.77,,,,,,4,0,0,0,2,2,72764 CL DC,CL72764DC_
1048,"CONCORD WALLCOVERINGS Wallpaper Border Fruits Pattern Pears Apples Plums Grapes on Vine, Die Cut Edge for Kitchen Cottage Farmhouse, Beige Yellow Green Purple, 15 ft by 4.7 in CO77191DC",B0BJFMYZRB,,,18.77,,,,,,4,0,0,0,2,2,77191 CO DC,CO77191DC_
1049,"CONCORD WALLCOVERINGS ? Wallpaper Border Kitchen Pattern Vegetables Peppers Tomato Eggplants Garlic for Kitchen Farmhouse, Green Yellow Purple Red, 15 ft by 7 in CO77194",B09K82FY4G,,,18.22,,,,,,10,0,0,0,2,7,77194 CO,CO77194_
1050,"CONCORD WALLCOVERINGS Multicolored Fruits Wallpaper Border Featuring Lemon Orange Cherries, Colors Green Yellow Red, Size 7 Inches by 15 Feet BN2000B",B07RG89J4L,,,18.22,,,,,,3,0,0,0,2,2,BN2000B,CS-DZU0-L3S7
1051,"CONCORD WALLCOVERINGS Wallpaper Border Vintage Pattern Tableware Fruits Flowers for Cottage Kitchen Dining Room, Beige Purple Blue, 15 ft by 9 in CS8331B",B0BK2VFZT1,,,18.77,,,,,,5,0,0,1,2,2,8331 CS B,CS8331B_XX
1052,"CONCORD WALLCOVERINGS ? Wallpaper Border Modern Abstract Design, Colors Green Blue Yellow Red Orange Purple, Size 9 Inches by 15 Feet CT102242",B0954PYQRL,,,18.22,,,,,,0,0,0,0,2,8,102242 CT,CT102242_
1053,"CONCORD WALLCOVERINGS Wallpaper Border Country Pattern Field Scarecrows Flowers American Flags for Cottage Kitchen Dining Room, Green Blue Red Yellow, 7.25 Inches by 15 Feet CUP3372",B0BFFWHZ6S,,,18.77,,,,,,4,0,0,0,2,2,3372 CUP,CUP3372__
1054,"CONCORD WALLCOVERINGS ? Wallpaper Border Garden Vine Pattern Cherry Apples Plum Flowers for Kitchen Cottage Farmhouse, Green Purple Dark Red Beige Fawn, 7 Inches by 15 Feet CV103721",B09FFW69Y1,,,18.22,,,,,,7,0,0,0,2,8,CV103721,CV103721._
1055,"CONCORD WALLCOVERINGS ? Wallpaper Border Architectural Pattern Beach Coastal Row Houses for Living Room, Red Blue Brown White Green, 6.75 Inches by 15 Feet CW32191B",B07QCQVY7B,,,18.77,,,,,,6,0,0,0,2,2,32191 CW B,CW32191B_
1056,9 1/2 in x 15 ft Prepasted Wallpaper Borders - Pineapple Fruits Wall Paper Border HF8648B,B07KMVVDWD,,,18.92,,,,,,0,0,0,0,2,13,HF8648B,CZ-ST5T-XSWY
1057,"CONCORD WALLCOVERINGS ? Artistic Glass Pots Wallpaper Border, Featuring Vases with Fine Flowers, Colors Yellow, White, Blue, Pink and Green, Size 8.4 Inches by 15 Feet 5505681",B07QCQSFH4,,,18.77,,,,,,10,0,0,0,2,71,5505681,Concord_WB_0042
1058,"CONCORD WALLCOVERINGS ? Rustic Country Style Wallpaper Border Featuring Birdhouses and Floral Vine, Beige Green Brown, 8.6 Inches by 15 Feet 5810618",B07QFSKPPM,,,18.77,,,,6,,4,2,2,2,2,43,5810618,Concord_WB_0064
1059,"CONCORD WALLCOVERINGS Retro Teapots Wallpaper Border Featuring Handmade Teapots with Flowers, Colors Beige Red Yellow Pink, Size 10.25 Inches by 15 Feet WV7406B",B07RYZHZ7L,,,18.22,,,,,,0,0,0,0,2,2,WV7406B,1P-TSG2-VMMS
1060,"Concord Wallcoverings Wallpaper Border Vintage Pattern Pineapples for Cottage Kitchen Dining Room, Beige Green, 15 ft by 6.5 in GG54171B",B07QGXFL5V,,,18.22,,,,,,1,0,0,0,2,9,54171 GG B,Concord_WB_0267
1061,"Concord Wallcoverings Wallpaper Border Floral Pattern Flowers Leaves Swirls for Bedroom Living Room, Beige Pink Green, 15 ft by 9 in HB75708LL",B07QHXYTVT,,,18.77,,,,,,3,0,0,0,2,2,75708 HB LL,Concord_WB_0280
1062,"CONCORD WALLCOVERINGS Wallpaper Border Floral Pattern Roses Leaves for Bedroom Living Room, Red Green Yellow, 15 Feet by 7 Inches LY4308B",B07QGXFQY4,,,18.22,,,,,,0,0,0,0,2,2,4308 LY B,Concord_WB_0388
1063,"CONCORD WALLCOVERINGS Wallpaper Border Garden Pattern Flower Pots Ivy Gardening Inventory for Cottage Living Room, Blue Pink Green Cream, 15 Feet by 7 Inches PKB1239",B07QHXWTFH,,,18.77,,,,,,0,0,0,0,2,4,1239 PKB,Concord_WB_0427
1064,"CONCORD WALLCOVERINGS ? Prepasted Wallpaper Border Red & Leopard Flowers Printed Style Graffiti, Colors Pink Beige Brown, Size 9 Inch X 15 Feet RG3700B",B07QGXCMYH,,,18.77,,,,,,0,0,0,0,2,38,3700 RG B,Concord_WB_0449
1065,"Wallpaper Border Rustic Leaves White Silver Gold 15' x 5.25"" Pre-Pasted SF78325/O",B07QHY1FGW,,,18.22,,,,,,0,0,0,0,2,64,79285 NTX,Concord_WB_0459
1066,"CONCORD WALLCOVERINGS Wallpaper Border Kid's Pattern Sun Moon Stars for Nursery Room Kid's Bedroom, Blue Red Beige, 15 Feet by 7 Inches 30992120",B07QFSNLJ1,,,18.77,,,,,,7,0,0,0,2,2,30992120,Concord_WB_0506
1067,"CONCORD WALLCOVERINGS Wallpaper Border Kid's Pattern Toys Cars Planes Ships for Boy's Bedroom Playroom, Beige Blue Red Green, 15 Feet by 6.75 Inches 41638020",B07QFSN8HG,,,18.22,,,,,,2,0,0,0,2,2,41638020,Concord_WB_0515
1068,"CONCORD WALLCOVERINGS ? Classic Cottage Wallpaper Border Featuring Fishing Rod and Framed Fishing Attributes, Colors Grey Beige Brown, Size 8.5 Inches by 15 Feet AG042131B",B07QBR84PK,,,18.22,,,,,,10,0,0,0,2,48,42131 AG B,Concord_WB_0574
1069,"Wallpaper Border Moss Acanthus Scroll 7"" x 15' NT75998",B07QCQW9HB,,,18.99,,,,,,2,0,0,0,2,62,75998 NT,Concord_WB_0585
1070,"CONCORD WALLCOVERINGS Unique Abstract Wallpaper Border Featuring a Lovely Print, Colors Brown Red Beige, Perfect for Any Room Place, Size 6.87 Inches by 15 Feet KC063231B",B07QGXJJ1Z,,,18.22,,,,,,8,0,0,0,2,4,63231 KC B,Concord_WB_0801
1071,CONCORD WALLCOVERINGS ? Flowers on Gingham Wallpaper Border Featuring Butterflies Leaves Flowers on a Pretty Gingham Pink and Purple 5 inches by 15 feet NGB76802DC,B07QHZH8LP,,,18.22,,,,,,1,0,0,1,2,17,76802 NGB DC,Concord_WB_0856
1072,"CONCORD WALLCOVERINGS ? Wallpaper Border Kid's Pattern Ballet Shoes Ribbons for Girl's Bedroom Playroom, Beige Pink Purple, 15 Feet by 9 Inches PW4042B",B07QFSN9PR,,,18.22,,,,,,5,0,0,1,2,3,4042 PW B,Concord_WB_0897
1073,"CONCORD WALLCOVERINGS Wallpaper Border Floral Pattern Sunflowers for Cottage Kitchen Dining Room, Yellow Green Brown, 15 Feet by 5.25 Inches KR2213B",B07QBR8DVJ,,,18.22,,,,,,6,0,0,0,2,3,2213 KR B,Concord_WB_1260
1074,"Concord Wallcoverings Wallpaper Border Vintage Pattern Fashion Shop Clothes for Laundry Room, Beige Red Green, 15 Feet by 10.25 Inches OR138B",B07QHXWFFL,,,18.77,,,,,,3,0,0,0,2,2,138 OR B,Concord_WB_1366
1075,"CONCORD WALLCOVERINGS ? Wallpaper Border Floral Pattern Flowers Leaves for Living Room Bedroom Kitchen, Beige Pink Green, 15 ft by 9 in DB3685B",B09LP1G481,,,18.22,,,,,,7,0,0,0,2,2,3685 DB B,DB3685B_XX
1076,"CONCORD WALLCOVERINGS Wallpaper Border Damask Pattern Leaves Swirls Ornament for Bedroom Bathroom Powder Room Living Room, Silver Beige Gold, 15 ft by 9.5 in DW5150B",B0BK9ZPJDT,,,18.77,,,,,,3,0,0,0,2,2,5150 DW B,DW5150B_XX
1077,"CONCORD WALLCOVERINGS ? Wallpaper Border Vintage Pattern Plants Flowers Pots for Cottage Farmhouse, Brown Beige Green Pink Purple, 15 ft by 8 in DW95052B",B09K8TJJXQ,,,18.22,,,,,,0,0,0,0,2,7,95052 DW B,DW95052B_
1078,"CONCORD WALLCOVERINGS ? Wallpaper Border Vintage Pattern Fruit Garland Crown Molding for Kitchen Dining Area Cottage, Burgundy Brown Beige, 15 ft by 7 in DX1631B",B09KNVL4Z5,,,18.22,,,,,,0,0,0,0,2,2,1631 DX B,DX1631B_
